tag,question_id,display_name,title,body,answer_count,score,is_answered
javascript,79734850,stummyhurts,Set an APEX Item upon page load depending on what Interactive Grid is displayed,,2,0,False
javascript,79734819,Ruskibloo,"Why is the value at an array index, addressed by a loop&#39;s counter, still possibly undefined when just checked?",,3,6,True
javascript,79734579,Marc,Atomics.wait - `while(true)` or recursive function no output on stdout,,1,3,True
javascript,79734556,ivanbosk,MongoDB/Mongoose: Calculating large time series differentials in Node.js is too slow (~5–6 seconds) despite indexing and $slice,,0,1,False
javascript,79734470,cross,Firebase Cloud Functions return &quot;internal&quot; error with no logs after moving project in React Native,,1,4,False
javascript,79734435,teeeeee,How to navigate to page with a unique link that makes a particular tab active?,,2,-2,True
javascript,79734351,EagleEye1812,Remove color from a specific shape in a Leaflet Application,,1,0,False
javascript,79733895,Charlene Peters,Why can I not update the form data?,,0,3,False
javascript,79733683,&#211;scar L&#243;pez,Evaluating typed expressions in interactive ts-node,,1,1,True
javascript,79733638,Zain Amjad,Default prompt in langchain creating problem,,0,0,False
javascript,79733549,Alen.Toma,"mousePad app, issue calculating the right postions diff between mobile app and PC",,0,1,False
javascript,79733445,Rewind,Extracting elements of an OnClick function to modify it at runtime,,1,-1,True
javascript,79733309,Mike McCollister,How can I get the ID of the element that I am in?,,2,1,True
javascript,79733214,Oliver T.,Jira Xray Document Generator intersection of two arrays,,1,1,False
javascript,79733208,Alistair Hardy,fast-csv append writing headers to last row,,0,1,False
javascript,79733205,reset5,Leaflet map markers click event not working in certain scenarios,,0,1,False
javascript,79733111,Domenico,Integrating CookieBot via GTM on Hostinger AI builder,,0,3,False
javascript,79733104,shima mahmoud,Firebase Phone Authentication returns 503 Service Unavailable for Iraqi phone numbers,,0,2,False
javascript,79733010,arisa nurfarina,How to make Google Maps JavaScript API zoom in/out process smoother?,,2,2,True
javascript,79732802,M Hamza Mughal,Vue watch triggers on route change,,0,1,False
javascript,79732628,Eddy Freeman,Multiple hosts/shell applications with Nx Micro frontends,,0,1,False
javascript,79732623,JesseTG,"`async` test of a Fastify backend with `@fastify/websocket` times out, but also finishes",,1,0,True
javascript,79732597,Clyde,How to handle E2E API Request in Backend correctly?,,1,0,False
javascript,79732554,Uday Baldha,&quot;Cannot read properties of null (reading &#39;update&#39;)&quot; when closing all panels with leftHeader/rightHeader,,0,1,False
javascript,79732408,Alfredo Morales,Get date from TimeStampToken equivalent in Typescript,,0,0,False
javascript,79732340,Mohammad Jawad Barati,Generic mongoose dynamic module cannot inject options,,1,0,True
javascript,79732301,Jonathan Wood,"jQuery.trim() deprecated, but suggested replacement isn&#39;t the same?",,2,3,True
javascript,79732216,Egorallo,How to set up a responsive layout that wraps based on content width/wrapping instead of css breakpoints?,,0,1,False
javascript,79731809,ShiftyKeys,How to store a function&#39;s randomly selected message and not have it change upon refreshing the page?,,4,1,True
javascript,79731522,Offiz exe,Images blocking the navigation buttons,,3,4,True
javascript,79731409,Ahmet Yılmaz,How to scrollIntoView center element horizantally in old browser?,,2,2,True
javascript,79731337,anish,401 Unauthenticated Error while calling cloud functions in Google Firebase,,0,0,False
javascript,79731128,Muhammad Sameed,"DaisyUI theme not applying, always shows default theme in Laravel + Vite + TailwindCSS",,3,0,True
javascript,79731116,Kijupo,"How to replace first 3 digits, then set a Point and then set a point all second digit?",,1,-2,True
javascript,79731057,reza,Mobile Auto-Scroll Jumps Between Transcript Positions,,1,0,True
javascript,79731039,Prashil Shah,Flappy Bird web game runs at different speeds on different mobile devices (not browser/OS related),,1,1,True
javascript,79731036,user31226587,FullCalendar v5 resourceTimelineMonth — show a half-month (15-day) range without time slots appearing,,0,1,False
javascript,79730986,David Czerepak,React + pdf.js: PDF reloads/disappears when starting “calibrate from two points”; can’t change pages afterward. PDF Construction drawing scaling,,0,1,False
javascript,79730903,yacine hamiane,Mobile sidebar shifts and screen zooms when focusing an input field (WordPress / custom theme),,1,0,False
javascript,79730809,Duhamel,How to keep JS listener on element after request load with HTMX?,,1,-1,True
javascript,79730613,Jon,sanitize-html shows &quot;Module &#39;path&#39; has been externalized&quot; warnings — how to hide them?,,1,2,False
javascript,79730598,Momohan,Issues with an email forwared working on Google Sheets,,1,-1,True
javascript,79730452,qboshenkiy0_ Shirufietto,How to launch the server part of PHP via JS in the codeigniter framework?,,1,0,False
javascript,79730393,CupOfTea00,My Exit variant in framer motion is not working,,1,0,False
javascript,79730110,YoNoms,"Issue in sending binary image data (LONGBLOB in MySQL, Bytes in Prisma) to my front-end as a PNG",,0,0,False
javascript,79729834,Benwhittaker25,"Show a similar type of error that min/max shows, if input start time &gt; input end time",,1,0,True
javascript,79729538,Minh,How to properly handle onBlur with MUI &lt;DatePicker /&gt;,,1,1,True
javascript,79729396,Ruby Calderon,Decorator isn&#39;t valid inside of &lt;script&gt; in blade.php,,1,2,True
javascript,79729351,Eswar,Playwright soft assertion shows unrelated hortReject TypeError instead of actual assertion error,,0,0,False
javascript,79729350,gautam purohit,"Why does setTimeout(..., 0) log before fetch in browser, but changing to 1ms changes the order? And why is it always before in Node.js?",,1,-6,True
javascript,79729332,Simba,Is it possible to get a mean NDVI timeseries from from cluster?,,0,0,False
javascript,79729240,musketeerdt,Why does passing a Map.entries() iterator as child to a Collaspsible from shadcn render nothing unless I wrap it with Array.from()?,,1,1,False
javascript,79729185,user3163495,VSCode only checks JSDoc in files that are currently open. How do I make it check the entire project?,,0,1,False
javascript,79728768,Alsiro Mira,m3u8 HLS url VIdeo Not Playing with hls.js and Art Player,,0,0,False
javascript,79728757,user27457838,"Redirect() fails, returns 200 OK, and causes hydration mismatch",,0,1,False
javascript,79728724,MrVoodoo,ts-node + type: &quot;module&quot; : Can&#39;t find .js files?,,1,1,False
javascript,79728692,Yukta Singh,How to fix EAS Build failure to resolve local shared TypeScript package in monorepo setup?,,0,0,False
javascript,79728664,user2097439,camera.getPicture returns 20,,0,0,False
javascript,79728643,cdoublev,Why are namespaced import entries sorted alphabetically?,,1,3,True
javascript,79728638,Ashhhcodes,Results from AJAX/PHP call aren&#39;t showing when Submit button clicked,,1,-1,True
javascript,79728560,Logan Seeley,Why is my shader&#39;s linear map range function not smooth?,,0,0,False
javascript,79728545,coloradoman,Change detection not working for child input,,1,2,False
javascript,79728474,Hene,Percent encode HTML form,,2,0,True
javascript,79728417,Greg Reynolds,Problem with setting focus after displaying a modal,,2,0,True
javascript,79728392,Kevin Zheng,How to drilldown from one plot to multiple stacked/faceted plots?,,0,0,False
javascript,79728229,Simon Ferndriger,ServiceWorker not reacting on periodicSync event,,0,0,False
javascript,79728085,MeltingDog,How to solve Cypress &quot;this page was cleared by navigating to about:blank&quot; issue on Cypress 13.14.1?,,1,0,False
javascript,79728033,claudiopb,Are There Hidden Dangers in Using for...in in JavaScript?,,3,-4,True
javascript,79727843,Дмитрий Маркитан,If show template with disabling a form at the same time - then a form not disabling,,1,1,False
javascript,79727802,Rosario Di Mari,NgClass doesn&#39;t work if it depends on a variable which change from an Angular Material Dialog,,1,2,True
javascript,79727781,kelvinfrog,How to make DT datatable factor filter dropdowns keyboard accessible (ADA compliant) in R Shiny?,,1,1,True
javascript,79727506,Buchow_PHP,How to prevent payments on address errors?,,1,1,False
javascript,79727373,Jocobes,Animate rotation of an object in JavaScript,,1,2,True
javascript,79727075,Marc,Register custom node in embedded node-red application,,0,0,False
javascript,79727063,Ragul PR,SSE connection fails(in server) when multiple connections are made from the same device,,1,3,True
javascript,79727059,DELVIN N J,mat-menu loses input focus when filtering scrollable content,,1,0,True
javascript,79726733,Yun Zhu,"Cannot capture navigator.runAdAuction() parameters from seller td.doubleclick.net, but works for other sellers",,0,0,False
javascript,79726602,Noex,Reload page after mysql input in different folder and file,,1,-1,True
javascript,79726278,Martins Balodis,Why element.querySelector matches a selector referencing an ancestor of element?,,3,2,True
javascript,79726232,Kaligule,Searchstring to WikiData entity ID,,1,2,True
javascript,79726099,A71,Why is the script in the Cloudflare worker&#39;s online editor not updated after automatic deployment?,,1,0,True
javascript,79725873,Domas,How do I smoothly animate falling elements after removing items from a CSS grid-like layout?,,2,4,True
javascript,79725868,user4221591,Export data table to Excel starting data from fourth row,,0,0,False
javascript,79725765,Leonardo Hysesani,Why can&#39;t I draw on HTML canvas,,1,0,True
javascript,79725573,Jen,How to I add an information button to a carousel feature so it expands properly?,,1,1,True
javascript,79725552,Stacklep1,Certain div not being shown on deployed site in Firefox?,,1,0,False
javascript,79725337,Simon Ferndriger,How to load firebase service worker with different configurations (test/prod),,0,0,False
javascript,79725268,David Callanan,How to fsync a directory?,,2,3,True
javascript,79725194,spaceemotion,Only match phrases when not part of other phrases with regex,,2,-6,True
javascript,79725094,Maximko13,Problems handling numbers too great in JavaScript,,2,2,True
javascript,79724803,hamed rahafrouz,Using P5 createRadio() in a class and having two objects of that class leads to radio buttons not functioning independently,,1,1,True
javascript,79724797,CoderJo,TypeScript solution for managing filesystem path structure,,1,1,True
javascript,79724642,Charlie Winters,How to use javascript onmouseover event from multiple divs of same class?,,3,1,True
javascript,79724505,Ginto,Make ng-container work inside a HTML table,,2,0,True
javascript,79724493,Minyeop Jang,What is &#39;tex2svg is not a function&#39;?,,1,-2,True
javascript,79723937,Somdotta Sarkar,Password in .env.local file next.js,,3,0,True
javascript,79723920,chrwahl,How to style elements in the shadow DOM from a child element within the custom element,,3,2,True
javascript,79723828,noel-reeds,`subClass extends baseClass` and not with `new` keyword in JavaScript,,1,-1,True
javascript,79723686,Amos wijaya,Supabase: Getting &quot;role &#39;user&#39; does not exist&quot; error only when authenticated user queries product/category tables,,1,1,True
javascript,79723636,Ahmed Ch,React Native KeyboardAvoidingView causes flickering and layout shift when keyboard opens/closes,,0,0,False
javascript,79723469,dr_E,Rselenium won&#39;t switch to another tab,,1,1,True
javascript,79723373,Georgi E,I have a problem with the my the accuracy of my roulette game,,1,-3,False
javascript,79723360,bguiz,Correct way to obtain address from a BIP39 seed phrase using ethersjs v6,,1,0,False
javascript,79723351,David Callanan,Provide manual tracking context when performing reads,,2,1,True
javascript,79723319,Einar Zotterman,"Display child of clicked parent, hide other children in list",,2,0,True
javascript,79723278,EmreRl,How to Get the Option Names in Discord.js,,0,1,False
javascript,79723042,Bill,Change value of a single prop in a Zod object in JS,,1,2,True
javascript,79722828,user4221591,On passing json stringify data to controller method shows null,,1,1,True
javascript,79722792,Ahmed abrar,How to show my maps website in JavaFX application using WebView?,,0,0,False
javascript,79722766,Lucas Amos,Nextjs DYNAMIC_SERVER_USAGE error when using generateMetadata,,2,-1,True
javascript,79722716,Daniel Reinaldo Zorro Forero,Jest30+JSDOM30+Node24 TextEncoder is not defined,,1,-1,True
javascript,79722701,BlueDogRanch,CSS styling while using a Javascript callback and tabs in Google Custom Search results,,1,0,True
javascript,79722439,Slicedpan,Mismatch between Puppeteer remote object id and Chrome dev tools object Id,,1,0,True
javascript,79722390,Rasil Abro,Dropdown and icon misalignment in browser extension on scroll and iframe fields,,0,1,False
javascript,79722350,BraveEvidence,How to Include Javascript Code while writing a Moodle Block Plugin?,,0,2,False
javascript,79722336,Ronny Omnier Gonz&#225;lez Vargas,How is the new change detection in Angular 20 handled in AppConfig?,,1,0,False
javascript,79722232,Venkata Raju,Can&#39;t resume using the Iterator helper object,,1,4,True
javascript,79722209,Stam Mashu,Firebase Cloud Function fails with &quot;TypeError: func is not a function&quot; on deployment,,1,0,False
javascript,79722133,lonix,Reset form to its original state using alpine.js,,1,0,True
javascript,79722116,fuma,Javascript or other way to calculate Sum depending on value of other column,,2,1,True
javascript,79722030,Yousef Dawood,RevalidatePath doesn&#39;t Reset The useTransition&#39;s pending state,,2,0,True
javascript,79721801,Aayman Khalid,Subscription Request failing in authorize.net with invalid token error,,0,0,False
javascript,79721794,nane limon,How to solve Velo error WDE0075: Metadata for Reference type field not provided when programmatically adding a REFERENCE field?,,0,2,False
javascript,79721729,root,Show specific frames of SVG animation,,2,0,False
javascript,79721686,Алексей Смирнов,How to type class method arguments based on function arguments passed to class constructor,,1,1,True
javascript,79721603,Scrib68,"Select Range of Columns by Dates, Fill with values from another column",,2,1,True
javascript,79721569,Tommy Leong,Load of WASM with CSP enforced,,0,0,False
javascript,79721445,user31184281,Is it possible to modify the body of an outgoing HTTP request in a Firefox add-on?,,1,3,True
javascript,79720990,czg,How to position MUI Dialog in the top-right corner?,,1,0,True
javascript,79720983,Miachi Solomon,is there a difference between elements created dynamically with JavaScript and elements in HTML,,3,0,True
javascript,79720908,McMurphy,DragEnter event not firing reliably when mouse enters the drop zone,,0,0,False
javascript,79720876,Iv&#225;n Le&#243;n Capote,Video camera freezes when switching from rear to front with Twilio Video in Chrome for Android,,0,0,False
javascript,79720819,Kadal,How to detect mouse over canvas,,0,1,False
javascript,79720797,Kevin Spoors,Convert Alpine.js on-click to Datastar data-on*,,0,1,False
javascript,79720561,Patric,How to create a HUD-like overlay in a CesiumJS canvas (non-html)?,,0,0,False
javascript,79720544,Leftium,How to preserve PicoCSS (form) styling inside Swiper &lt;swiper-slide&gt;?,,1,1,True
javascript,79720503,Sergey A Kryukov,Focused state of a button is not rendered on button.focus() called from a click handler,,1,-2,False
javascript,79720281,yep shushi,How can I build TailwindCSS from an HTML string?,,1,1,True
javascript,79720111,Stephan Bergmann,Using SharedArrayBuffer from a SharedWorker?,,1,2,False
javascript,79719967,M101,Getting Blade components as elements inside Javascript without using identifiers or parents,,0,0,False
javascript,79719966,Varun V,Voice Wake Word Not Working on Mobile Browsers Using SpeechRecognition in React,,0,1,False
javascript,79719832,c.bear,Flexbox and rotation,,2,1,True
javascript,79719657,Neko,I have a report in HTML and I need to highlight some data when the use inputs some text,,0,0,False
javascript,79719603,user27909701,How to track cursor position and get the current key in vanilla-jsoneditor,,0,1,False
javascript,79719578,Yogesh,Changing the default Print Option for Margin in Chrome,,2,0,False
javascript,79719520,tobiasBora,CSS selector computed aria name,,1,3,True
javascript,79719512,Olivier Campo,"In a diagram, relations are always deleted from last to first instead of selected",,1,3,True
javascript,79719498,Aisya Dewi,Postman Exchange Data Between Platform (Bitrix-Jotform),,0,1,False
javascript,79719387,Isaac King,Why does Wikipedia claim UTF-16 is obsolete when Javascript uses it?,,1,0,True
javascript,79719369,BootCamp,JavaScript Django default scaling using extends index,,1,0,False
javascript,79719312,Nerdy Bunz,How to choose the correct Firebase JS SDK version for firebase-messaging-sw.js in a Flutter Web app?,,1,0,True
javascript,79719198,rodriguezrrp,Finding earliest second-long window that contains more than X timestamps,,2,0,True
javascript,79719192,Cole Perry,Angular NBG Modal appears at the bottom of the screen,,0,0,False
javascript,79719085,HeptaZ,questions about callback function in javascript,,2,1,True
javascript,79718793,Sportek,Can I download all files from a selected directory using only drive.file permission?,,1,1,False
javascript,79718647,lucas,How can I manually trigger garbage collection from an asynchronous javascript function?,,2,1,True
javascript,79718645,Moblize IT,How to remove a nested property from an object in Firestore,,1,1,True
javascript,79718556,Anu Robinson,How to show both calendar and type-in time input in one modal using react-native-modal-datetime-picker?,,1,0,False
javascript,79718516,david,Adaptive Card JS SDK: Add Properties to Default Types,,0,1,False
javascript,79718506,Anwar Ali,&#39;toast.success&#39; is not working in my signup form,,1,-4,True
javascript,79718487,Avinash Dalvi,Angular *ngIf not removing element even when condition becomes false DOM keeps adding duplicate elements,,2,1,True
javascript,79718356,luigivampa,How to control/record the order FileReader uploads files in?,,1,0,False
javascript,79718328,TSR,How can I prevent the entire React app from crashing when an invalid component is rendered?,,7,-1,True
javascript,79718321,Saad Farooq,Tooltip from @radix-ui/react-tooltip not unmounting when using tailwind-animate,,1,0,False
javascript,79717970,user824624,browser sequentially sending data to server with sleep,,2,-1,True
javascript,79717792,J Bardo,Multiple Attendees for Automated Calendar Invite via Sheets,,1,1,True
javascript,79717763,WSA,Body of the character-controller undesirable penetrate deep into static and dynamic objects,,1,0,True
javascript,79717713,root,"SVG &lt;animate&gt; rewind works in Firefox, not in Chrome",,5,-2,True
javascript,79717659,Roller Roman,How to create a two line ellipsis text with some suffix?,,1,9,True
javascript,79717567,Bluebaron,frame-ancestors CSP not being observed,,0,0,False
javascript,79717549,Keston Pollard,Replace leading minus with trailing BCE,,1,-2,True
javascript,79717454,Petar Vasilev,Custom infinite carousel animation starts to jitter and slow down after running smoothly for a bit,,0,0,False
javascript,79717371,mnol,Text not displayed in modal despite the results,,0,0,False
javascript,79717018,Victor Corral Guillot,"Marker not rendering on first map tap — only appears after second tap, zoom, or any interaction (Expo SDK 53, RN 0.79.5, react-native-maps 1.20.1)",,0,0,False
javascript,79716915,felixbmmm,NextJS text input is causing the whole app to freeze,,3,2,True
javascript,79716840,Jyosna Vuttla,addEventListener vs onclick - which one overwrites the other?,,1,-2,False
javascript,79716826,siery,value setter for a custom select element with lazy loading,,0,0,False
javascript,79716754,user29564593,How can I reliably click YouTube’s “Skip Ad” button via content script in a Chrome extension?,,1,1,False
javascript,79716676,Keep Quit,python -playwright mouse pointer UI enable,,3,0,True
javascript,79716547,illion,chrome browser beforeunload api unwished action issue,,1,0,False
javascript,79716227,didi,Simple zustand store with persist do not get storage in local storage,,1,0,False
javascript,79715804,Buzzanags,JavaScript DOM manipulation in the Browser,,2,3,True
javascript,79715749,kar,Navbar animation flickering only on IOS Device,,2,2,False
javascript,79715650,thant zin tun,Implementing Lightweight chart custom plugin with konva,,1,0,False
javascript,79715607,wandy rge,"Why does the input field lose focus after typing a character unless I add autofocus, but still the whole page reloads?",,4,1,True
javascript,79715590,Entropy1024,Adding a list of variables to a spreadsheet,,1,0,True
javascript,79715580,Mark,Disable closing of popup,,3,2,True
javascript,79715354,Hunter,How to scale always-changing HTML text to fit on mobile screen,,2,1,True
javascript,79715304,EpicFrog2000,Modular approach to dynamically extending class behavior in JavaScript without modifying the original class,,2,0,False
javascript,79715085,Destramic,js multiple loop - time deduction,,1,-2,True
javascript,79715016,R.A,EWS on OVH Hosted Exchange,,0,0,False
javascript,79714933,krg,SSE (server side event) went CSE (Client Server Event) - loop sse.php working only with curl,,2,2,True
javascript,79714872,Marcel V.,Get incident report on Access-Contro-lAllow-Origin violation,,1,0,False
javascript,79714868,Aram Madoyan,"getCSRFToken is not defined error, JavaScript",,1,1,True
javascript,79714780,coloradoman,Angular difference between ng-container and div,,4,3,True
javascript,79714646,ismail ouzzine,Dimensions.get(&#39;window&#39;).height doesn&#39;t include StatusBar.currentHeight when the Status Bar is translucent,,0,0,False
javascript,79714645,Maddy Khan,How to stream Twilio media audio into n8n webhook for real-time transcription?,,0,2,False
javascript,79714585,Muhammad Kamran,React Native Webview Pull to refresh is not working on android,,0,0,False
javascript,79714571,Mark,Chrome DevTools - Memory Tab,,0,0,False
javascript,79714471,Giri patel,Efficient way to partially match stringified JSON in a string column using Prisma (without full JSON match),,1,0,False
javascript,79714453,Francis Mike Nathan,Code fullscreen element responsive by clicking fullscreen button? Simulate a mouse click?,,0,0,False
javascript,79714451,Nadeem,Why does my async function return a pending Promise instead of the expected value in JavaScript?,,1,1,True
javascript,79714394,Patrick Losser,Header alignment with sort/filter icons in PrimeReact DataTable,,0,1,False
javascript,79714393,Nuthanan Tharmarajah,"scrollbar appears, but modal not scrollable via trackpad or mouse",,1,0,True
javascript,79714370,Agnar Renolen,How to initialize an object in a less verbose way?,,3,4,True
javascript,79714356,Gary L Peskin,mediainfo.js 0.3.5 giving error loading MediaInfoModule.wasm,,1,1,True
javascript,79714098,Hieu Pham,How to build multiple HTML entry points with TypeScript injection and nested output folders in Vite?,,1,1,True
javascript,79714078,Cog,How can I return a Filter Formula reference range?,,2,0,True
javascript,79714067,Nancy K,Conflict between RequiredFieldValidator and Client Side CustomValidator,,0,1,False
javascript,79714043,Placza,Why does my brush algorithm draw jagged strokes?,,0,2,False
javascript,79713858,Abhishek Prasad,Deleting data points in qDrant DB,,1,0,True
javascript,79713654,Matthew Wilcoxson,How to redirect in React Router 7 in Framework mode to another route,,1,1,True
javascript,79713441,Rishikesh TS,Why does my input bar jump down and then return to its position after clicking the send button?,,0,1,False
javascript,79713433,Jon Wilson,Alter image after loading using html canvas,,2,2,True
javascript,79713099,Rutuja Kamble ,Why does JavaScript map() return undefined without return in arrow function?,,1,-2,False
javascript,79713083,Manjeet Yadav,Why does Angular 18 (ESBuild) generate so many initial chunks after migrating from Angular 14?,,1,2,True
javascript,79713002,H&#228;kka,Eslint Resolve error: Cannot find native binding,,5,3,True
javascript,79712991,Basj,Slider switch state modified by Javascript: animation is not triggered,,1,-1,True
javascript,79712787,TSR,How to set div margin or padding based on its own height (when the parent is a scrollable)?,,1,0,True
javascript,79712743,BruceyBandit,Unable to launch chrome via docker and testcafe,,0,0,False
javascript,79712276,4532066,Choose random options from multiple select menus at the same time,,2,2,True
javascript,79711884,Ritik Choudhary,how to get the list of all the purchase token in my app,,0,0,False
javascript,79711866,suraj karosia,AbortError: The play() request was interrupted because the media was removed from the document in React video conferencing app,,1,2,True
javascript,79711761,kittisak kea,Using path of react-native-image-marker?,,2,0,False
javascript,79711404,Peanut,Why is my p5.play.js not working on github but working on VScode?,,1,-2,True
javascript,79711280,Gary,Testing classList.contains before attempting classList.remove?,,2,3,True
javascript,79711164,Jo&#227;o Alpalh&#227;o,Layout and visual animations out of sync,,0,1,False
javascript,79711093,user26406990,Chrome Omnibox suggestions not showing when async response is delayed,,0,0,False
javascript,79710924,Beau,Clicking through multiple divs in a cycle,,2,0,True
javascript,79710923,striderhobbit,Manually highlight an inactive browser tab with JavaScript,,1,1,True
javascript,79710906,josue hernandez,QZ Tray fails to get signature and connecting,,0,1,False
javascript,79710841,Export,TypeError: Api.payments.SendStars is not a constructor when sending Telegram Stars gift with GramJS (telegram.js),,0,0,False
