tag,question_id,display_name,title,body,answer_count,score,is_answered
javascript,79675074,delphirules,How to use getBoundingClientRect() considering Windows screen scale factor?,,1,0,True
javascript,79675022,Sagittarius_A,How to synchronize hover time and seek time in a custom React video player using ReactPlayer?,,0,0,False
javascript,79674910,Al-Burh developer,Firebase Cloud Function 403 Forbidden Despite Admin Claim Set in Authentication,,0,0,False
javascript,79674868,Delivery-TI,Textarea char count javascript in Jinja2 for-lopp,,0,0,False
javascript,79674806,Julian,PixiJS v8 -Custom filter: Coordinates issue,,1,1,True
javascript,79674590,safetymonkey,FirebaseUI: Email link authentication link results in &quot;Requested action is invalid&quot;,,1,0,False
javascript,79674500,Mohamed Hedi ben salah,Handling 429 Too Many Requests Error with Google Gemini API in Next.js Client-Side Application,,0,0,False
javascript,79674483,magg,in rxjs how can I make a new observable wait another observable before it continues?,,2,0,True
javascript,79674460,Kenneth Lamacraft,"Javascript array, finding duplicates then return the locations in new array;",,3,-1,True
javascript,79674327,Fred Hors,Is this object created only once or every time I import it?,,1,-3,True
javascript,79674270,PizzaOverflow,How to get all the matches for a repeated group in a RegExp in JavaScript?,,2,4,True
javascript,79674228,masul_hasan,Video frames shake/stutter when rendering HTML5 video to Canvas during CSS animation,,0,3,False
javascript,79674218,asfreeman18,How to prevent filtered component from re-rendering over and over?,,2,-2,True
javascript,79674078,natevw,Is there a way to add data to the URL hash while browser is refreshing?,,1,0,False
javascript,79674048,dylatwork,&quot;callbackSuccess is not a function&quot; error when running async typescript,,0,0,False
javascript,79674032,imad,Problem rendering fullscreen/fixed canvas in iOS safari,,2,7,False
javascript,79673986,cdyswnnr,Next.js and Jest: TypeError `the &quot;original&quot; argument must be of type function`,,2,-1,True
javascript,79673962,Ole,Reacting when N videos have preloaded a given time interval,,1,-11,True
javascript,79673902,Korea South,When exactly is the Global Execution Context (GEC) popped from the Call Stack in JavaScript?,,0,0,False
javascript,79673876,Han Essa,Integrating New Google Maps Autocomplete API into Django Project,,0,2,False
javascript,79673868,Safwan,How to change iFrame src with a default value when the original src does not exist?,,0,0,False
javascript,79673714,Pashupati Pariyar,Sticky card scroll effect,,0,0,False
javascript,79673613,gene b.,Highlight menu item with top section scrolling into view including last non-top visible sections,,1,1,True
javascript,79673570,zwirbeltier,vitest fake timers and nested setTimeout,,1,1,True
javascript,79673426,dheeraj,Getting error code: out of memory in chrome when i run webdriverio v8 test scenarios,,0,1,False
javascript,79673423,Jelle,Update price/number based on multiple checked checkboxes,,2,1,True
javascript,79673187,Arkan Mansuri,Trouble loading icon in SCSS using Angular 19,,1,1,True
javascript,79673106,Alessandro-Techtion,Syncfusion Scheduler misaligned rows in Timeline view,,0,0,False
javascript,79672906,Adrian Norman,Laravel front-end changes not persisting after stopping composer run dev,,1,1,True
javascript,79672904,Владислав Колесов,Canvas text is not rendered correctly when generating PDF,,1,1,True
javascript,79672741,Ethan,Jest setup with React native cannot use import statement outside of a module,,0,0,False
javascript,79672662,Xixo,Can I retrieve Cordova localStorage in React Native?,,2,1,True
javascript,79672590,Muhammad Ahmed,Baileys crashes with TypeError: logger.trace is not a function,,0,0,False
javascript,79672575,Phurten Jang Sherpa,How can I add a responsive toggle button for a mobile nav menu using JavaScript?,,1,0,True
javascript,79672566,Pavel Siarheyeu,How does Apache ECharts handle bigint numbers when constructing a &#39;value&#39; type X-axis?,,1,1,True
javascript,79672543,Augustine Calvino,How to get canonical IANA timezone ids in javascript,,0,3,False
javascript,79672433,Vitaliy Tsirkunov,Is it possible to make Ultra-low-latency Android WebRtc client for web camera?,,0,1,False
javascript,79672310,An5Drama,Is splash:select different from document.querySelector?,,1,0,True
javascript,79672302,Seikikai,Problem with Angular lifecycle in Angular 19,,1,1,True
javascript,79672278,ami,"Vue 3 Audio Visualizer Not Working | No errors in the console, audio not playing, canvas not updating",,1,1,False
javascript,79672262,Jorre,How to show full autocomplete suggestions in JavaScript,,2,0,True
javascript,79672235,whetstone,Error when accessing JS package in Dataform,,1,0,True
javascript,79672210,Jignesh Gohel,ContentSecurityPolicy for script set to nonce but Ajax request not executing javascript response despite identical nonce,,0,1,False
javascript,79672204,Ilya Konrad,Programmatically render/destroy components from non-host component (Angular),,2,0,True
javascript,79672021,Jouni Kantola,Highcharts styledMode: What are the performance effects of enabling it?,,2,1,True
javascript,79671953,dev dev,How to convert a php regex to javascript to fetch urls from string?,,2,0,False
javascript,79671877,Welnyr,How to access component from a custom directive?,,1,0,False
javascript,79671851,Henrik Holl&#243;si,Rectangle selector tool across multiple charts in Plotly,,1,2,True
javascript,79671845,Adrien FERRIERE,How to customize Highcharts Euler diagram?,,1,2,True
javascript,79671546,Lee,Flutter WebView (flutter_inappwebview 6.1.0) not loading external JS script in React page — blank screen issue for few users only,,1,1,False
javascript,79671544,Arun Krishna,How to cleanup querySelectorAll in useeffect,,2,0,True
javascript,79671492,Absar Ahmad,React Bootstrap Cards are overlapping,,1,1,True
javascript,79671475,Diego,How to fix &quot;Uncaught SyntaxError: Unexpected token &#39;export&#39;&quot; when using Webpack output.module?,,0,0,False
javascript,79671401,ivo,Disabling Bootstrap event delegation for specific DOM elements,,1,0,True
javascript,79671290,Lee,Force Scrollbar to Appear For Mac Sequoia Users,,1,0,False
javascript,79671057,Marius Lutter,JavaScript/CSS Smooth “Iris” Scroll Transition: Circle Grows but Won’t Shrink on Scroll-Up,,2,1,True
javascript,79670817,Sing O Song,Update Current Time Automatically And Update Database via ajax php mysql after video fully watched,,1,-3,True
javascript,79670561,Leo,Change label of Interactive Grid button without creating whole new button,,1,0,True
javascript,79670415,hukuto7750,includeHTML() function not work in every browser (js and css effect miss),,0,0,False
javascript,79670406,imgrv,Rewrite Route in Nuxtjs3,,0,0,False
javascript,79670386,Haidepzai,How to prevent Enter from submitting while the user is still typing/composing (IME input mode) in JavaScript/React,,1,1,False
javascript,79670321,Nageswar Kumar Murmu,AWS Lex chatbot iframe in Angular gives ExpiredTokenException after 1 hour — how to handle token refresh?,,0,0,False
javascript,79670315,Banana-Master,Why does this JavaScript comma operator example return different results?,,3,-2,True
javascript,79670197,MAZ,GA4 custom event parameter not available after 96+ hours (despite working setup),,1,0,False
javascript,79670089,REJH,Preconnect/dns-prefetch Firebase Auth,,0,0,False
javascript,79669952,MeltingDog,"How can I use Cypress to retrieve an array of elements, then run a test against each of those elements?",,0,0,False
javascript,79669913,Big Shwan,What is causing this CSS cube to &quot;clip&quot; when rotated three-dimensionally?,,1,1,False
javascript,79669858,Alexander,How can I make the form fill with its corresponding information from the database when it&#39;s displayed?,,2,0,False
javascript,79669844,MONIR,Can I use :hover on an element that is invisible but still takes up space?,,2,0,False
javascript,79669527,siv,How to get the min/max xaxis values after user zooms in on apexcharts linechart?,,1,1,True
javascript,79669432,vincent clerc,Tus protocol with Laravel,,2,1,True
javascript,79669328,Sukima,When to use getReader() versus [Symbol.asyncIterator](),,1,2,True
javascript,79669060,Yuriy L.,Undefined browser extension response,,0,1,False
javascript,79668807,PierBJX,How does click event behavior work when dragging?,,1,3,True
javascript,79668522,Jay,How to migrate my CRA .eslintrc.js config to eslint.config.js in a new Vite + React 19 app,,1,3,True
javascript,79668225,Marcin J,Share function between content and background script (chrome extension),,1,0,True
javascript,79667885,CatMan2000,"The Node.js application using the dotenv package fails to read environment variables from the .env file. As a result, the following error occurs:",,1,0,False
javascript,79667810,stummyhurts,Conditional Reset Button with Confirmation,,2,0,True
javascript,79667768,randomblink,"Cloud Run service has SSL certificate error, causing Failed to fetch from Chrome Extension",,0,1,False
javascript,79667646,Emmanuel Ayomide Fatolu,Having issues with function scoping and generally how the browser JavaScript engine executes JavaScript code,,1,0,True
javascript,79667493,Neha Soni,Vue 3 + Jest: Function doesn’t trigger expected state change in test,,0,0,False
javascript,79667480,ameur,Jest : Cannot find module &#39;@/components/auth/Login.vue&#39; from &#39;src/tests/Login.spec.ts&#39;,,1,0,False
javascript,79667441,nikMe,How can I cache video content with the &lt;video&gt; tag in React?,,1,3,False
javascript,79667413,Salim Shrestha,How to get the attributes of the currently active widget in Elementor editor via JavaScript?,,1,0,False
javascript,79667398,Jo&#227;o Ferreira,How to use the same configuration file in both content scripts and background module in Manifest V3?,,0,0,False
javascript,79667353,Sauci,Embedding Plotly graph in pytest report,,0,3,False
javascript,79667299,Harry Mustoe-Playfair,How to dynamically update nested data with dependency on parent?,,1,1,True
javascript,79667042,Gorja Poornima,How to restrict access to a page in React based on Supabase user login?,,0,0,False
javascript,79667014,Armen Kakosyan,Module Federation Vite is not working on Safari: ReferenceError: Cannot access uninitialized variable,,0,2,False
javascript,79666995,Pier Bezuhoff,How can Apps Script WebApp retrieve request&#39;s cookie in doGet(e)?,,0,0,False
javascript,79666986,Lionel Rowe,"Equivalent of `supportedLocalesOf` for letter-case conversion (`toLocaleLowerCase`, `toLocaleUpperCase`)?",,1,2,False
javascript,79666941,Heitor Shoiji Kimura,problem -&gt; npm http-server dowloading file,,1,0,False
javascript,79666859,Gabi G,Frida gives the error &quot;not a TypeError: not a function&quot; on a simple call to Java.perform,,0,2,False
javascript,79666838,Envy Beth,Infinite loop inside the block with console.log(&quot;3&quot;) in it. redirecting keeps erasing my locales i think,,0,0,False
javascript,79666788,vanilla,js v8 function inlining,,1,0,True
javascript,79666762,Tony,Laravel Filepond not including file input with Post or Put in Request,,2,1,True
javascript,79666580,Christof Beckers,Wix Visual Glitch After Minify,,0,0,False
javascript,79666573,MaTok,New line in a X post,,2,0,False
javascript,79666570,uckelman,Why is the response empty when handling an XmlHttpRequestUpload load event?,,1,-3,True
javascript,79666521,user8758206,How to block the page from loading in an inline script until async operations finish,,3,1,True
javascript,79666495,Tau,MemberExpression evaluation order of null/undefined base,,1,1,True
javascript,79666445,Henok Tesfaye,Contentful multiple content types filtering,,0,0,False
javascript,79666441,Alice,Inferring the drawing direction of a rotation+reflection matrix applied to a canvas,,1,1,True
javascript,79666349,eliezra236,"Drizzle ORM + Postgres, how to specify Postgres database Schema? defaults to public",,1,1,False
javascript,79666328,FaniX,How to retrieve the visible content of an element including `select` elements?,,2,1,True
javascript,79666280,Rahma Begag,switch company trigger in odoo 17,,0,0,False
javascript,79666242,Lyn,Can&#39;t pause audio,,1,-3,True
javascript,79666233,Mango,How can I animate opacity on a parent container while preserving backdrop-filter: blur() on child elements during the animation?,,1,1,False
javascript,79666067,Hubert Kauker,Can two equivalent JavaScript generators be derived from each other?,,1,-3,False
javascript,79666050,Иван,"How to set up a cluster in Yandex Maps to display the sum of the values ​from the labels, and not the number of labels themselves?",,0,1,False
javascript,79665887,Robert,why spawnSync give different result than the actual command,,1,1,True
javascript,79665838,iguanaiza,"@rendermode InteractiveServer crashes app when used with HttpContext, but I need both to apply themes",,2,0,False
javascript,79665786,seventeen,App claims out of memory despite enough allocated,,2,1,True
javascript,79665682,Vikas Dagur,"Why am I getting &quot;req.body is not set&quot; when using @apollo/server with expressMiddleware in Apollo Server, even after adding express.json() before it?",,2,0,True
javascript,79665667,user19953380,"Resolving errors with recharts graph in nextjs, incorrect type/null",,0,1,False
javascript,79665629,Smajl,How to call hook after delete mutation?,,1,0,True
javascript,79665584,TastySefBitz,OnClick works only once,,1,-2,True
javascript,79665573,Matakoththuwakoni,How to put --select zone-- as default value on the dropdown input,,1,0,False
javascript,79665500,dipanshuu447,Why I&#39;m getting error every time i try to access the protected route instead of redirect to /login?,,1,-3,True
javascript,79665490,Explorer,How do I resize banners to fit nicely on mobile?,,1,0,False
javascript,79665432,Yogesh,Dynamic function returns string instead of object array as expected,,1,-2,True
javascript,79665330,cpow,Saving variables /time stamps to avoid read calls,,2,-1,True
javascript,79665150,Pierre de la Verre,JS - using xmlDoc.selectNodes .. from .net,,1,0,True
javascript,79665067,Jignesh Gohel,Seeing Node.js-related warning for module word in jquery.min.js,,2,-1,False
javascript,79665052,Kishan Bhola,gridstack draggable not working on dynamic widget,,0,0,False
javascript,79665023,Talha,How i can click youtube ads skip button programmatically?,,0,0,False
javascript,79664918,0Interest,Add a parent div that includes translated children in its dimensions,,1,-3,True
javascript,79664628,tracker_id_sub91,Stripe subscription and one time payment response,,1,0,True
javascript,79664552,Michael,Evt.which and Evt.keyCode deprecated and JavaScript Errors,,2,0,True
javascript,79664408,TSR,How to hook several state fields in React Component,,0,0,False
javascript,79664320,Adam Hunter Peck,Why is cubic bezier animation different in CSS vs JavaScript?,,0,1,False
javascript,79664233,user3272018,How to use parametrized queries in selectors?,,1,2,True
javascript,79664206,jfredsilva,Keep at least on tick on the middle of one of the X-axis,,1,0,False
javascript,79664190,Rusty,Focusing input box on keydown causes key to be typed into input box,,1,1,True
javascript,79664118,user30589464,How to center align horizontal bars with multiple datasets?,,1,1,True
javascript,79664082,Chris J. Z&#228;hller,Get file length for rss.xml enclosure tag in Eleventy,,1,1,True
javascript,79664020,SachinD,How to set seprate IFRAME body to each TextArea in view page using TextArea(Kendo) [Seting up Max Limit to text area],,1,-1,True
javascript,79663995,MilesZew,How would you use JSDoc for VSCode intellisense on an extended class method,,0,2,False
javascript,79663943,Tapialj,useAnimatedValue is not a function,,0,2,False
javascript,79663938,Sneha Natarajan,How to change MUI-X default Datagrid scrollbar styles? How can I customize it?,,1,0,False
javascript,79663799,maria_turner,PCIbex sequence of trials resulting in blank screen,,0,1,False
javascript,79663758,Thomas Green,How do I get abcjs installed correctly?,,1,-3,True
javascript,79663709,Make it green,React Input Issue: Can&#39;t Delete First Character or Replace Default Value in Input Fields,,1,0,False
javascript,79663594,Follow Magnus,Sum of Inverse Squares Series Rounded to 2 Decimals,,1,-1,True
javascript,79663368,Veikko M.,Cypress not intercepting a request with mock data while seemingly detecting the request,,2,1,False
javascript,79663328,Denis Kramarenko,UseMemo or Regular Variable Declaration in React,,1,-1,True
javascript,79663077,Raymond,Better analysis with Tone.js,,0,0,False
javascript,79663061,Seth Jamal,Modal is not showing up,,1,1,True
javascript,79662926,Tran Loc,Generated file displays text correctly but text is not searchable in Chrome (but works in Safari and Edge),,0,0,False
javascript,79662893,user3040244,Is there a way to use aggregate query to get sum of product of two fields in firestore/NodeJs?,,1,1,False
javascript,79662820,Anonymous,How can I persist Firebase user login session using Expo and JavaScript in React Native? Still redirects to Start screen after app refresh,,1,2,True
javascript,79662486,siv,Trying to make an updating timeseries with working show/hide functions from legend with Apexcharts.js,,0,0,False
javascript,79662337,J. Gr&#252;nenwald,How to create a JS event for a button in a DataTable using modules?,,1,2,True
javascript,79662269,maxim,Playwright storage state preserved in GH runner at next run,,0,0,False
javascript,79662253,Ahmed Wagdi,How to Fix CORS Error When Calling Firebase Cloud Function from a Different Domain?,,0,0,False
javascript,79662242,jack-feddersen,`import.meta.dirname` and `import.meta.filename` are `undefined` when using `ts-jest`,,0,0,False
javascript,79662142,user2602640,leaflet panels in shiny (with animation and leafletproxy),,1,3,True
javascript,79662126,Plantt,Is there a built-in identity function in JavaScript?,,1,0,True
javascript,79662070,Товарищ Понечка,File can become invisible for Deno import,,1,1,True
javascript,79661968,user29777152,How can I properly integrate my custom type declarations into my compiled npm package?,,0,0,False
javascript,79661542,DominikReber,FCM Send push Message results all of a sudden into &quot;No key or keyFile set&quot;,,2,0,True
javascript,79661456,Ankit Vashisht,AWS IoT Core WebSocket MQTT via React,,0,1,False
javascript,79661435,Alice,"Aligning reflected, rotated image to the bottom right (or top right, etc.) of a shape outline with transforms/dealing with rotated bounds",,1,2,False
javascript,79661167,John O,Array of images each with an onload event listener,,2,2,True
javascript,79661157,Nadia B.,CameraType is Declared but its value is never read,,1,1,False
javascript,79661115,Cheeki,ElectronJS will not execute. No Error Messages,,0,1,False
javascript,79660954,Tim,Primeng P-tree checkboxes aren&#39;t checkable,,2,1,True
javascript,79660951,Catherine Hwang,How can I get a text outline effect on the web?,,0,0,False
javascript,79660887,SCMS,Adding ordered list styles to markdown parser,,0,0,False
javascript,79660872,Karan,Elasticsearch Runtime Query Performance Issues,,0,1,False
javascript,79660814,Dimuthu Pinsara,history.pushState without user interaction causes popstate not to trigger in Firefox – how to fix this?,,0,1,False
javascript,79660813,Gonzalo,Filepond fieldset not working as expected?,,0,0,False
javascript,79660808,wothke,Is there a workaround for Chromium&#39;s broken getImageData() implementation?,,1,0,False
javascript,79660806,NIMISH BANSAL,Chromium proxy authentication with webRequest.onAuthRequired extension not working (MV3),,0,0,False
javascript,79660713,Bet Co,Why does V8 deoptimize certain closures with inline caching despite seemingly monomorphic access patterns?,,0,0,False
javascript,79660653,Mohammadreza Imani,Getting ERROR TypeError: Cannot read properties of undefined (reading &#39;ɵcmp&#39;) after Change the builder to application builder,,0,1,False
javascript,79660539,user1099480,How is the Webuntis Lesson ID generated and does it change with updates?,,0,0,False
javascript,79660521,rovac,How to make element sticky to bottom of window vh but continue to scroll with rest of page when scrolling past its container?,,3,3,True
javascript,79660408,Srushti Kansagara,Open two months date picker ( month range picker),,1,0,True
javascript,79660393,TryingAgain,Sort datatable column so blanks appear last,,1,0,False
javascript,79660318,nowox,How to associate CSS with Tailwind/Shadcn?,,0,0,False
javascript,79660195,XIMRX,Can we add padding time or multiple color styling to FullCalendar events?,,0,0,False
javascript,79660184,vatsal,Changing global variable value between re-render and setstate function call breaks UI,,1,2,True
javascript,79659992,Manob Biswas,How to disable Electron.js panel window movable area click event on macOS?,,2,2,True
javascript,79659899,Bajrang Patidar,Can we open Acumatica Smart Panel by JavaScript method and fill data in Smart Panel and save it to Acumatica?,,0,0,False
javascript,79659719,miku,How to add autocomplete suggestions to st.chat_input() in Streamlit (like Google Search)?,,0,0,False
javascript,79659689,37bandiko,How do I make a Bootstrap hamburger menu button only appear when the user is viewing the blog section?,,1,0,False
javascript,79659646,Carl Yerkovich,Rails 7 - Duplicate javascript files are loaded into the web server,,0,1,False
javascript,79659624,Claire Spivak,How can I track a variable across different sessions/users?,,1,0,True
javascript,79659577,Sarah Jane,How do I run a function on a click event?,,2,0,True
javascript,79659412,Meek,Add dots/ellipsis to pagination,,1,-1,True
javascript,79659379,username-generic,"Is there a way to edit multiple Ranges made within an element with the &quot;contenteditable&quot; attribute, without breaking them?",,1,0,True
javascript,79659364,Chris,"After polling a server using setinterval, file will download but won&#39;t open in a new tab",,1,0,True
javascript,79659233,Danilo Silva,It is possible in Oracle Apex 24.2 to build something to download/export a table that has SDO_GEOMETRY in shapefile format?,,1,0,False
javascript,79659214,Mango,Foreground Shape Doesn&#39;t Fully Cover Background – Black Pixels Visible Through Foreground in Overlapping Elements,,1,-3,False
javascript,79658965,Dewashish Sahu,React Search Page Not Fetching Blogs from Render-Hosted Express + MongoDB Backend,,1,-5,True
javascript,79658958,eliezra236,How to make Zod behave like interface and class forced to implement said interface,,1,1,True
javascript,79658936,Eliyahu Machluf,Event Loop behaves differently with blocking code,,0,1,False
javascript,79658836,BH07,OAuth Popup Flow Design — Handling Full Redirects Without window.opener or Reliable window.closed,,1,1,False
javascript,79658834,John Deighan,"Is this a bug in Javascript, NodeJS and/or deno?",,0,0,False
javascript,79658740,Meek,Call function from Class onclick,,1,-1,True
javascript,79658477,Ivan Kuckir,Generating and downloading a binary file in iOS Safari,,0,0,False
javascript,79658306,David Pham,cursors is not defined at Game.update (Phaser 3),,1,1,True
javascript,79658179,DiamondNether90,How can I register a new event listener with a function without it overriding the old listener?,,3,0,True
javascript,79658143,Jarvis Davis,How can I copy over records from one tab to another for a specified criteria?,,1,0,True
javascript,79658015,Marian07,Error trying to use &quot;gemini-2.5-pro-preview-06-05&quot; in Firebase Vertex AI,,1,2,True
javascript,79658002,Guofeng Qiang,"Autodesk platform service aps-iot-extension viewer issue Error:404, 500",,1,0,True
javascript,79657951,user30750731,Persistent &#39;ReactCurrentOwner&#39; TypeError with React Three Fiber in Next.js 15.3.3 App (Firebase Studio),,2,0,False
javascript,79657885,Sakura NoTamashi,"Swiper slide is not taking the full width of the carousel, even when specified as show 1 slide",,0,0,False
javascript,79657852,user1263981,set conditional tooltip on Kendo UI Grid column,,0,0,False
javascript,79657805,Sourabh Kushwah,CSS page counters not visible in generated PDF using @page rule,,2,0,False
javascript,79657796,Maria Kazi,Plotly Charts Not Displaying Correctly Despite Valid Data and Code,,1,2,True
javascript,79657753,jwmiddelburg,Dynamic Loading in Parcel reverts back to the index.html,,0,0,False
javascript,79657736,Phil Preen,How do I get all the attributes of an SVG path,,1,0,True
javascript,79657709,Edmond,Chest animation stops working after adding item popup,,0,0,False
javascript,79657644,Nemh,"My while loop is not running smoothly, where did i go wrong?",,4,1,True
javascript,79657620,BoulayM,Use data from mapping fetch to feed a component,,1,0,False
javascript,79657576,tytx t,"Chakra3 ui Select slot recipe - indicator color change on trigger state change (focused, hovered, expanded)",,0,0,False
javascript,79657491,2033,How to perform TTS operations with JavaScript?,,1,1,True
javascript,79657434,Harsh k,Issue with trying to focus textarea on doubleClick,,3,1,True
javascript,79657382,Razvan Zamfir,How can I disable drag and drop in Dropzone.js?,,1,2,False
javascript,79657371,username-generic,Is there a way to edit a Range without discarding other existing Ranges?,,1,1,True
javascript,79657351,flourigh,Postgres UPDATE table SET jsonb typed column with javascript var not work for remove an array item,,1,2,True
javascript,79657280,Chen,Nuxt3: A function can behave differently depending on the execution context (server-side or client-side),,1,0,False
javascript,79657255,Baljit Singh,Getting Error while using Cron Job Scheduler in Node.js,,0,1,False
javascript,79657144,Wotan2004,Why is my Chess.js board in React not shown?,,1,1,True
javascript,79657122,S Bonnet,Odoo 18 (js): How to extend the native payment_paypal module to activate the PayLater feature?,,1,0,True
javascript,79657052,Lukasz,Issue with dependencies in react native,,1,1,True
