tag,question_id,display_name,title,body,answer_count,score,is_answered
javascript,79835729,Dharmik Ghori,Firebase Cloud Function for app_remove Event Not Triggering in Production,,0,0,False
javascript,79835695,Yanir Aton,"Can I export animation data from Chrome DevTools Animations panel (timing, easing, keyframes)?",,0,1,False
javascript,79835692,irankhostravi,How to slide 6 images at a time with vertical sidebar navigation?,,1,0,False
javascript,79835627,Terrysquid,Listener pointerdown missing touchscreen input when tapping rapidly,,0,0,False
javascript,79835551,Pradeep,create a pdf file using angular 19 using bootstrap,,0,-7,False
javascript,79835382,hakeem gabr,why is it skipping the cards when switching between slides,,1,1,False
javascript,79835348,saad jlassi,"Hey guys, I need some recommendations about a technical interview challenge",,5,0,True
javascript,79835275,cheescakesss3,Centring pages in ‘react-pdf’ and ensuring they scale properly,,0,-1,False
javascript,79835227,kirvel,Implement STL flexi toy maker / add hinges to STL files programmatically,,1,0,True
javascript,79835112,Saksham Tyagi,fetch() API returning undefined when logged with console.log(),,0,-3,False
javascript,79835101,Anupam Thakur,React: AudioContext sound plays inconsistently on mouse wheel rotation,,1,-3,True
javascript,79835100,Sarout,I want to create dynamic real-life like family tree as HTML/SVG in javascript,,4,1,True
javascript,79835016,Michelle Haase,Iframes positioning,,0,-1,False
javascript,79834999,Yash Gorasia,Should I use transformer functions for the data I get from API?,,3,1,True
javascript,79834930,Ayush Jain,How to retrieve the running iOS Simulator UDID for simctl commands?,,0,0,False
javascript,79834922,adil riyan,Backend PDF generation is inconsistent; is frontend PDF creation a better approach for a QR-based coupon system?,,0,-5,False
javascript,79834916,Invincible_Atlas,Is using eval() clientside actually a security risk?,,4,2,True
javascript,79834835,Tariah Steve,Error in moving tasks from scheduled to mytodo,,0,-4,False
javascript,79834791,samm,"JavaScript replace regex produces two trailing commas for &quot;a,b,c &quot; string",,4,-6,True
javascript,79834747,DoYouLikeHam,How to simplify JavaScript in After Effects for this conditional statement?,,2,-3,True
javascript,79834149,Ali Sedghi,cant send an array of js via formdata to controller(my viewmodel wont bind to it),,0,-3,False
javascript,79834096,Guy Stephane,Nginx Reverse Proxy (Node.js/Docker) Fails with ERR_SSL_PROTOCOL_ERROR,,0,-1,False
javascript,79834088,SoundestMage,How can I add animation to image slides?,,0,-3,False
javascript,79834006,adrianhb,Smplest OL map gives a blank screen,,1,1,True
javascript,79834003,Robert Mdee,Embedding YouTube videos in Bootstrap modal components returns Error 153,,0,0,False
javascript,79833948,Ivan Rubinson,How to prevent rerender of identical component in child?,,2,1,True
javascript,79833797,Ed S.,Can&#39;t get the ID of a SVG group,,3,4,True
javascript,79833751,Baangla Deshi,How to revert the code to span replacement of code tags with translated text in between which was translated by Google translate?,,0,-8,False
javascript,79833709,Philip Chege,Chrome throws “Failed to connect to MetaMask” even though my React project does NOT use crypto/web3 (Opera works fine),,0,-3,False
javascript,79833683,Jay Geezy,Dont know what this is,,0,-11,False
javascript,79833678,Shalieen2448,How to do a previous/next function?,,1,0,False
javascript,79833648,Misiur,Match a string not preceded by a pattern,,7,0,True
javascript,79833602,Davorin Mestric,"How does the Gboard, when typing into a textfield on Chrome mobile, do &quot;select all&quot;?",,0,0,False
javascript,79833594,Artem Kobziev,JavaScript crossword input freezes and focus does not move to the next cell,,0,-2,False
javascript,79833585,Isaac,Firestore rule to allow users to pull only chats they are members of?,,1,0,False
javascript,79833560,toreric,Cannot send data to Node Express after converting from CJS to ESM,,1,3,True
javascript,79833502,Ali Sedghi,cant upload preloaded images + new uploaded images in UpdateProduct page via asp-form,,0,-1,False
javascript,79833403,Hector Socarras,ESM &amp; CommonJS Dual Support in an Existing Node.js Project,,1,-2,False
javascript,79833393,Sak G,React-three-fiber: Cannot convert undefined or null to object (useRef),,0,1,False
javascript,79833360,MPG,How would I make a dropdown of numbers to select in the input value rather than entering the number?,,0,-3,False
javascript,79833355,Bart Friederichs,What domain to add to Firebase Authentication for Firebase Studio with Google Auth?,,0,1,False
javascript,79833353,selectstart,Can&#39;t declare variables used in mathematical equations output,,0,-3,False
javascript,79833235,user31965232,Is it possible to connect to a local Python server using secure web sockets from a browser console on an HTTPS webpage?,,0,0,False
javascript,79833139,kunal tyagi,Why does querySelectorAll return an empty NodeList inside my custom class even though elements exist?,,0,0,False
javascript,79833113,SAHIL SINGH RANA,Why is my JavaScript querySelectorAll not selecting elements by ID?,,4,-4,True
javascript,79833098,Jacob Bischoff,&quot;grid-template-columns&quot; and &quot;grid-template-rows&quot; style properties not getting set by script,,1,1,True
javascript,79833083,Nikhil kumar jaiswal,How do I categorize products by price and display them on different pages using JavaScript?,,1,-2,False
javascript,79833069,utternovice,HTML static webpage - how would I have any of the files present in a particular directory be selected in a src,,2,1,True
javascript,79833054,mohamed yusuph,Failed to fetch when GETting json file from backend using Jwt Token,,1,-1,True
javascript,79833052,Chris Sermanni,How can I display the Persian language fonts?,,1,3,False
javascript,79832948,Varelion,Electron IPC: File objects arrive as empty objects {} in main process,,1,-1,True
javascript,79832892,Flain,Why does &quot;message:successful_payment&quot; event work randomly?,,0,0,False
javascript,79832849,Ayush Raj,Why doesn’t my CSS animation trigger when toggling a class with JavaScript?,,0,-1,False
javascript,79832780,Ignacy,"Draw a diamond pattern, representing the top face of a cube",,2,-4,True
javascript,79832753,Rohitraj03,Why is my JavaScript function returning undefined even though the variable is declared?,,0,-3,False
javascript,79832751,Sajokrit,Mobile Chrome: Fixed position overlay disappears when scrolling inside sidebar,,0,0,False
javascript,79832600,Eli,What’s the best architecture for mixing local AI + cloud AI inside a React/JS app without turning the codebase into spaghetti?,,1,0,True
javascript,79832435,Tjeerd Evers,Token in HttpOnly Cookie not being send when using include,,0,-4,False
javascript,79832413,Anand Deep Singh,Unable to download webpack in windows,,0,-1,False
javascript,79832346,suresh kumar,App Store Connect API(Nest Js): Subscription created but status shows &quot;Missing Metadata&quot;,,0,0,False
javascript,79832343,juztcode,Getting spacing and alignment in JSON Forms correctly,,0,-1,False
javascript,79832267,varaha,How to reliably capture high-quality audio/transcripts from Google Meet using a bot (without official API)?,,0,0,False
javascript,79832251,Pavan Raghuwanshi,Geofencing logic is Optimized or not for 1000 length gps position data or something 2000 geofencing lat log center?,,0,-1,False
javascript,79832183,willyab,rails 8 error: Uncaught SyntaxError: import declarations may only appear at top level of a module,,0,0,False
javascript,79832150,Samuel Franklin,Light Mode Flash (in dark mode) On Reload Page,,2,2,True
javascript,79832054,Danziger,Supabase Realtime Broadcast service sending but not receiving messages,,0,-1,False
javascript,79832014,user2854333,Regex validator with expression,,1,4,True
javascript,79831969,Ričardas Olikaiskas,How to manipulate the property &quot;Show as Warning&quot;?,,0,-1,False
javascript,79831967,Eli,Weird OpenAI streaming bug: concurrent JS streams randomly mix chunks across responses,,1,3,False
javascript,79831934,Shohjahon Jalilov,How to determine if a TypedArray is signed?,,2,0,True
javascript,79831908,ub0baa,Svelte with SVAR dynamic DataGrid: forced update,,0,0,False
javascript,79831853,jean-marie Detrey,"javascript : how to display and scroll a remote pdf, on a browser non dependant way",,2,0,True
javascript,79831848,Jency,CKEditorError: plugincollection-plugin-not-found {&quot;plugin&quot;: null} when integrating custom CKEditor5 plugin with Drupal 10,,0,0,False
javascript,79831846,stot,How to display &lt;NavLink&gt; components outside MemoryRouter in React Router?,,2,0,True
javascript,79831765,Kraker,Why does the checkbox become unclickable when width is lowered?,,3,-3,True
javascript,79831747,Shukla Dev,Filter on worksheet columns re-triggering excel office.js custom functions even when it is not volatile functions,,0,1,False
javascript,79831606,Eli,React 18 streaming chat messages updating with stale state,,1,2,True
javascript,79831509,Todd,Can&#39;t delete text from Google Doc,,1,0,True
javascript,79831473,AizuddinAzman,Missing semicolon in Playwright,,2,-2,True
javascript,79831461,AwaisMehnga,React SSR (being used as binding in cloudflare) HMR required in cloudflare worker,,0,0,False
javascript,79831445,dichterDichter,Alternative to local window storage in browser,,1,0,False
javascript,79831352,yym xtxd,ECharts x-axis labels truncated with grid left/right 0: How to offset first/last labels without affecting spacing?,,1,3,True
javascript,79831318,Baangla Deshi,How to force Google Translate to translate text between &lt;code.....&gt; and &lt;/code&gt; tags on my webpage?,,0,-6,False
javascript,79831302,Baangla Deshi,How to run a function after Google translate translates a webpage?,,0,-6,False
javascript,79831061,Chris,Unable to use the Alexa REST API to update the &quot;datastore&quot; for an Alexa Widget,,0,0,False
javascript,79830849,monteis,Run JavaScript in Python wrapper: problem by module calling,,0,1,False
javascript,79830784,Mayank jandu,Unexpected stale state in React when setState runs inside a loop,,0,0,False
javascript,79830780,Julien trqt,How to remove the iOS accessory bar on mobile?,,1,0,False
javascript,79830760,corsair83,How does the space complexity notation change with input type?,,1,-3,True
javascript,79830743,1million_ naira,Using setTimeout within useEffect() to debounce searching in react native pagination,,3,0,True
javascript,79830725,Emilio Fern&#225;ndez,Embedded Mobile layout not working in PBIP reports,,0,1,False
javascript,79830721,Scipion,NG 21 + Vitest + Non-standalone component with async pipe,,0,1,False
javascript,79830527,Torben,Handling YYYY-MM-DD as UTC,,1,2,False
javascript,79830886,Valerie Ho,Prevent a new tab from opening when opening WhatsApp from Googlesheet OnEdit,,1,0,False
javascript,79830361,Fomantis,Perspective transform breaks at extreme Z values,,0,0,False
javascript,79830354,Out of Nightvale,Create clickable target in contenteditable div,,1,0,True
javascript,79830329,Nils,How to get an element into a variable in the dev console,,0,-2,False
javascript,79830324,zezhong zhang,Best practice for converting Annex B H.265/HEVC bitstream to MP4 (hevc / length-prefixed) format in the browser?,,0,0,False
javascript,79830311,corsair83,What is the space complexity of this palindrome program?,,3,0,True
javascript,79830297,Charles K.,Can&#39;t get scroll animation code to execute,,0,3,False
javascript,79830287,guli5057,Kendo MultiColumnComboBox select event sometimes not triggered after item selection,,1,0,True
javascript,79830039,Ali Sadain Tanvir,Best way to initialize data in next js app router with zustand,,2,0,True
javascript,79829943,AncientSwordRage,Why isn&#39;t my config correct to build a webapp with &#39;object-inspect&#39; using vite?,,0,-4,False
javascript,79829895,stephano,I would like to know why the ref in my onMessage handler requires spreading before flushing,,1,1,True
javascript,79829876,user3163495,JavaScript: Why was dynamic *this* binding ever allowed into the language?,,3,3,True
javascript,79829842,KaranSRMA,Can a React (Vite) SPA prevent a component from being included in the client bundle until after backend authentication?,,0,-1,False
javascript,79829837,Ant,Why isn&#39;t the class style applied and the button working inside the webcomponent,,2,3,True
javascript,79829832,Vignesh,How to convert javascript object of mongodb based query to mongodb query as parse,,1,0,True
javascript,79829812,Ethan Martin,Generating Interactive Documentation from Javascript Source Code,,5,0,True
javascript,79829811,lunarchild,How to select an element after changing its class name with DOM?,,2,0,True
javascript,79829787,Tirna,React Native Metro suddenly trying to process TypeScript files it can&#39;t understand,,0,1,False
javascript,79829763,Ethan Martin,How does the GJS documentation pipeline work with DevDocs?,,0,0,False
javascript,79829591,Shoaib Ahmed,How to update a large number of mongodb documents in a tree structure?,,0,0,False
javascript,79829586,eliezra236,DOMPurify - How to allow only specific style,,1,0,True
javascript,79829480,mahdi heydari,"What is the recommended way to implement client-side error handling in Vike (Vue 3), similar to Next.js / Nuxt?",,0,-2,False
javascript,79829424,Shaan,Azure App Service: Extracting a 60MB node_modules ZIP takes longer than running npm install — how to speed this up?,,1,0,False
javascript,79829346,Rasel Babu,How to properly highlight text in expo?,,1,-1,False
javascript,79829033,Powl_London,"Option Array, locating and returning array with correct criteria",,5,0,True
javascript,79829026,Ian Ross,"React Native Android: TypeError “Cannot read property &#39;getConfig&#39; of null” after removing Reanimated (RN 0.75.2, Hermes)",,1,4,True
javascript,79828961,d.k,Reason why Facebook Flow doesn&#39;t have type for objects with null prototype,,4,0,True
javascript,79828840,Andy88,Components inheriting properties from a base class (directive),,0,0,False
javascript,79828836,Priya Singh,Express.js: &quot;Cannot set headers after they are sent to the client&quot; error with MongoStore sessions - page renders correctly Error [ERR_HTTP_HEADERS_ERR,,0,-3,False
javascript,79828826,Sieara Smith,My goal is to have an MP4 autoplay and loop when in viewport,,0,-3,False
javascript,79828797,AizuddinAzman,Cannot read properties of undefined (reading &#39;goto&#39;),,3,1,True
javascript,79828768,Geovanne Costa,Is it possible to create a custom cursor with page scrolling on mobile using JS?,,0,1,False
javascript,79828727,leteli,Make native pinch-to-zoom trigger real layout reflow (without horizontal scroll) on mobile,,4,2,True
javascript,79828708,Mark Fee,Validate a PutRequest Item to be used in a BatchWriteItem,,1,0,False
javascript,79828696,DucVjt,Error entering clerk&#39;s email verification code,,0,-2,False
javascript,79828683,Jayadeepan M,How to close the WhatsApp In-App Browser?,,0,-2,False
javascript,79828660,Somebody Who Exists,How to use javascript to add an image to a div on click,,1,0,False
javascript,79828626,Unit Unitovich,The link with the parameter goes to the node in vis.js,,1,-1,True
javascript,79828619,Daniel Barral,How can I check if the peer (relay server) is connected?,,1,0,False
javascript,79828521,dbac,Match datalist again after separator,,1,0,False
javascript,79828423,Ahmad Hassan Khan,The card details section not apperaing during Tap Web Card SDK V2 integration on website,,1,0,False
javascript,79828337,user20042604,Why is my CSS outline appearing on input for both mouse click and keyboard focus despite using :focus-visible?,,3,1,True
javascript,79828334,dont stalk,Where is the yjs.js UMD bundle in the latest Yjs releases? VS Code Webview cannot load ESM,,0,0,False
javascript,79828308,Nicer Ata,How can I update multiple Elementor button links globally from one place in WordPress?,,0,-2,False
javascript,79828193,Saqib Ali,How to print a date in this specific format?,,1,-1,True
javascript,79828175,Stanislav Matveyevich,Making a palindrome out of a string of random letters (or any given value type inputs),,8,1,True
javascript,79828045,amyK,"Web carousel very slow on Safari desktop, fine everywhere else",,0,-1,False
javascript,79828005,Bosscoe,Elementor Pro 3.32 Reduced Motion Preference,,0,-3,False
javascript,79827970,Samyar,get the data from the server with fetch API,,0,-2,False
javascript,79827948,letsCode,"Firebase deploy getting eslintrc error, module not found",,1,-1,False
javascript,79827940,moortje,Netflix toggle subtitle keyboard hotkey using JavaScript,,1,0,False
javascript,79827925,Archit Gupta,Component Re-mounts on redux state changed,,0,-2,False
javascript,79827831,Richard,Optimising a function by caching the results or removing the function enirely?,,2,1,True
javascript,79827810,ALIMEROUANE BERRABAH,How to give a pixel wood texture to font similar to Stardew Valley?,,1,-3,True
javascript,79827789,dead-in-a-damn-ditch,Set a limit/cap on how many children can be appended with appendChild()?,,2,4,True
javascript,79827740,Hekmat,100ms ON_TRACK_UPDATE and ON_PEER_UPDATE is not firing in React Native,,0,1,False
javascript,79827688,Pranay Reddy,JWT authentication: req.user is undefined in protected routes even though token is valid,,0,-2,False
javascript,79827649,John,Using turfjs.destination is returning incorrect coordinates,,1,0,True
javascript,79827610,JuanyBGoode,How do I get the clicked image on my tab gallery to open the correct display container when viewing the html file on a browser?,,1,0,True
javascript,79827586,Ben,Changing product quantity in Stripe embedded components,,2,-3,False
javascript,79827529,Olamide Olumide,Why does this code keep printing 11? When I go through it I expect it to print 9,,2,0,True
javascript,79827363,Max Koretskyi,loaderDeps running multiple times and sometimes missing search param at all,,0,-1,False
javascript,79827261,Misagh Emamverdi,Javascript notificationclick is not called on Flutter web app debug build,,0,0,False
javascript,79827223,Shady Medic,Loading images in HTML – Differentiation between no response and error response,,1,0,False
javascript,79827169,Schiswot,How to correctly implement a global redirect/navigation guard in Expo Router?,,0,0,False
javascript,79827167,user3209013,SPA framework output access without node or any server setup?,,2,0,True
javascript,79827130,Sudhanshu Tiwari,"Transparent, unfocusable and clickable BrowserWindow in Electron",,0,-1,False
javascript,79827054,Blair A,How to remove a css border from a twitter embed?,,2,-1,True
javascript,79826997,Peter Gerdes,RubyMine: Custom JS Version (ideally ECMAScript 2022),,0,-1,False
javascript,79826921,Samyar,how do I get html page with fetch for reload part of the page?,,1,-3,False
javascript,79826859,Stuart L,"Copy and paste with .getValues / .setValues, but clearing the array inbetween",,1,1,False
javascript,79826823,Imperishable Night,WebGL canvas `toBlob()` result shows glitched color spots not seen on the canvas (cause: invalid pixel value for premultipliedAlpha),,0,3,False
javascript,79826773,Chand jr,Why does heavy object cloning degrade JS performance even when using structuredClone compared to manual optimization?,,1,0,True
javascript,79826725,Connor R,Get CSS RotateZ() from matrix3d,,0,0,False
javascript,79826716,Emma Harris,Issue with select2 and option group,,2,0,False
javascript,79826685,fernando parra,how to remove extra dashboard button React Refine,,0,-1,False
javascript,79826679,Allan Jardine,Prototype / scope for nested method,,1,0,False
javascript,79826616,user31922018,How to build an executable bundle.js for Node.js?,,0,0,False
javascript,79826561,user123456,Why I am getting this error in js file Uncaught TypeError: $(...).on(...).fail is not a function?,,1,0,True
javascript,79826513,UnOne SciDiez,Is JavaScript addEventListener to images possible? Unable to click on an image to add to cart,,2,2,True
javascript,79826452,chichi,Full screen cover does not work for a react video player component,,1,-5,False
javascript,79826423,Novice,Does creating multiple JWT authentication tokens mean multiple server sessions for concurrent requests?,,1,3,True
javascript,79826386,Davidy,"RegEx in Javascript, Match multiline text between Tokens",,2,-4,True
javascript,79826373,perplexed,Leaflet.VectorGrid with multiple interactive layers,,0,0,False
javascript,79826322,margherita pizza,Nuxt.js pre-render data in the server for the seo purpose,,3,0,False
javascript,79826301,Arjun Asokan,BridgeLink 4.6.0: How to validate XML against XSD (with dependent imports) using Lookup Manager? Java access removed,,1,0,False
javascript,79826297,Corsair,Unexpected behavior of switch compared to if/else,,2,-1,True
javascript,79826296,Audrey G.,Embedding Randomized Vignette Data into Qualtrics,,0,0,False
javascript,79826282,Brandi,How to get 100 small viewport height in Javascript?,,2,-1,True
javascript,79826178,user20986345,How to safely generate unique Bitcoin receive addresses client-side in JavaScript?,,1,0,False
javascript,79826085,ARGHHHHHH,Is it possible to compile C++ that user types to Wasm Client side using web containers,,0,-1,False
javascript,79826011,h3xStream,Error &quot;[Layer Chart] You set `yNice: true` but the yScale does not have a `.nice` method. Ignoring...&quot;,,1,-1,True
javascript,79825836,Szymon Zachariasz,How to make photoshop like Brush Engine with opacity and flow with JavaScript,,1,1,True
javascript,79825726,NeilM,google maps platform builder agent issues?,,0,-4,False
javascript,79825719,AlexBor,Multiply array elements by a number and store result to a new array,,7,1,True
javascript,79825632,nikhil singh,Updating state in React.js but there is a lag of one element,,0,-3,False
javascript,79825565,Argishti Hakobyan,Price filter fails after currency switch,,0,0,False
javascript,79825511,Rithik Nirwan,liferay javascript client extension not working,,0,0,False
javascript,79825482,a3code,what effect and math is behaind animation at antigravity google with Three.js?,,1,2,False
javascript,79825418,Alex652,onWorksheetChange not working with Data Validation,,0,0,False
javascript,79825341,Chirag,Text overlaps and resets position when rendering multiple text chunks in a loopHow,,1,1,True
javascript,79825276,iOSProgrammingIsFun,Use items from local storage to pre-populate a webform,,2,0,True
javascript,79825110,Sak G,why &#39;this&#39; is undefined inside WebGLRenderer().setAnimationLoop(),,0,-1,False
javascript,79824977,MRichards,How to Animate using Canvas in Angular,,0,2,False
javascript,79824841,Mahmoud Tarek Mahmoud,Vue/Laravel - CSRF token mismatch,,0,0,False
javascript,79824768,Kavya Vaishnav,Next.js API route returning 404 when calling axios.post from client component,,0,-1,False
javascript,79824733,Andrea Sacconi,why markers need to be tapped twice to have the popups opening in the right position (inside the leaflet map),,0,1,False
javascript,79824659,Franta,Scroll an option into view on open,,2,2,True
javascript,79824260,Anhelina Rabtsevych,tanstack/react-query using onSuccess to refetch the data,,1,4,True
javascript,79824193,GlicyDev,Passing user data from NextJS middleware to the client component,,1,1,True
javascript,79824143,Alteria,How do I make reusable HTML elements in a Django project?,,1,1,True
javascript,79823838,Lee,Wait for User Input,,6,2,True
javascript,79823809,LJones,What prevents Javascript memory leaks in software applications?,,2,0,True
javascript,79823796,letsCode,Firebase Functions v2 onCreate user,,1,0,False
javascript,79823726,Ebraheem Al-hetari,How to correctly set up Pinia with Inertia.js SSR in AdonisJS 6? Getting &quot;getActivePinia() was called but there was no active Pinia&quot;,,0,0,False
javascript,79823690,Anika Conley,PixiJS v7 and Pixi-Spine UMD incompatibility,,1,0,False
javascript,79823652,Mike McCollister,How can a CSS animation transform scale start from where a transition left off?,,4,0,True
javascript,79823611,Niamh Driscoll,Is it possible for JavaScript to detect other tabs,,7,0,True
javascript,79823322,Zain Mateen,"ScrollTrigger not working after route navigation (works on localhost, breaks in production)",,2,-1,False
javascript,79823288,minhson Bui,How to prefill values for fields using startup parameters in SAP Fiori Form Entry Object Page,,0,1,False
javascript,79823158,Daniel,How to externally link to a storybook section,,1,0,False
javascript,79823140,Ratinax,Compare unordered lists / objects javascript,,4,0,True
javascript,79823125,RobinSta,Outlook Office addin onMessageSendHandler on Mac and Web,,0,0,False
javascript,79823121,Mohammad Tahsiri,Creating a scrolling diagonal carousel with N images,,0,0,False
javascript,79823019,Ujjawal Bindal,why nextjs is sending async prop from a component to a suspended child component,,3,0,True
javascript,79822900,X 2,Unable to show line on Combined Bar and Line chart on React native Gifted charts,,1,1,True
javascript,79822899,StardustQ,How to move background while scrolling the page?,,1,-3,True
javascript,79822784,AirenMarie,I tried everything and I just wanna toggle my elements,,1,-4,True
javascript,79822743,Congregator,Javascript interface not downloading IMAP attachments through PHP,,1,4,True
javascript,79822629,Sak G,Scripting inject.js vs content.js in browser extension,,1,0,True
javascript,79822604,Beowulf,Using different legend labels for each curve of a 2 lines graph,,0,0,False
javascript,79822426,Jarosław Bielawski,Group offset from JSON in fabric.js,,0,0,False
javascript,79822363,user31167817,The operation failed for an operation-specific reason: Cipher job failed,,1,2,True
javascript,79822358,Niraj DCP,Safari/Chrome: Caret not placed before/after non-editable elements in rich-text editors (Jodit),,0,0,False
javascript,79822330,melis16,Rounding madness - No matter the code I keep on getting rounding issues. I don&#39;t know what else to do,,0,-2,False
