tag,question_id,display_name,title,answer_count,score,is_answered
pandas,79289735,Sdeb,Model Training for Segmentation,0,2,False
pandas,79289725,white.seolpyo.com,Multiply the value determined for each section,2,0,True
pandas,79289561,Mohamad Osama,Fill Missing Values in a datetime64[ns] col - pandas,2,1,True
pandas,79289173,user1718097,Recasting values in Pandas dataframe that meet specific requirements,2,0,True
pandas,79289121,Nathan Enix,Python yfinance library,1,0,False
pandas,79288891,elipersonal,pandas equivalent to pyspark QuantileDiscretizer,0,0,False
pandas,79288814,Anthony Guida,Export Python charts excel with grid layout,1,1,True
pandas,79288779,pandoradox23,ARIMA model Using YYYY-WWW results to &quot;No supported index is available. Prediction results will be given with an integer index beginning at `start`.&quot;,1,1,False
pandas,79288685,ZHoskin,Legend has one entry for every combination of two parameters -- how can I simplify the legend?,0,0,False
pandas,79288345,Brian Hamilton,Creating groups from dataset based on time intervals,0,0,False
pandas,79286346,chocalaca,Return something from onclick?,0,0,False
pandas,79286118,quant,How to calculate daily weights which satisfy certain conditions,1,0,True
pandas,79286117,ju.,Use attribute name as column name for sqlalchemy in pandas read_sql(),0,1,False
pandas,79285449,amance,Find average rate per group in specific years using groupby transform,2,2,True
pandas,79285338,lpca,Cannot compare tz-naive and tz-aware timestamps,2,1,True
pandas,79284999,Th&#233;odore Targerian,pd.read_csv() not working with parse_dates,4,0,True
pandas,79284835,JLB,How to efficiently make a large matrix of 1s and 0s,1,0,False
pandas,79284623,Fish1996,Reindexing only valid with uniquely valued index objects,0,0,False
pandas,79284407,MaximJ,Pandas conditional filtering on categorical values,2,0,True
pandas,79282130,Ishigami,Split a Pandas column of lists with different lengths into multiple columns,2,1,True
pandas,79282047,Adam Majdi,Pandas: Merging two dataFrames with repeated values in the merging column,2,0,False
pandas,79281613,skoleosho97,How to transpose and modify a pandas dataframe based on column values,5,0,True
pandas,79281494,Anisa B.,Calculate all missing values for specific data using pivot tables in pandas,2,0,True
pandas,79281302,Preetam Pal,ImportError from Pandas while running XGBoost model on python,0,0,False
pandas,79280766,Arbab Qaisar,Getting empty dataframes after webscraping from Wikipedia,3,0,False
pandas,79280737,ryang6476,IndexError: index out of range in self when training Dynamic Word Embedding Model (DWB),0,0,False
pandas,79280318,matentzn,"Skip rows with pandas.read_csv(..., comment=&quot;#&quot;) but allow hash in the data?",3,2,False
pandas,79280091,Scoodood,Behavior of df.map() inside another df.apply(),1,1,True
pandas,79279637,Anas,merge several columns of the same data into one,1,1,True
pandas,79279588,blahahaaahahaa,Interpolating time series data for step values,2,2,True
pandas,79279060,learner,How to use numpy.where in a pipe function for pandas dataframe groupby?,2,2,True
pandas,79278796,Ouroboroski,Update Pandas DataFrame slice row-wise using dictionary,2,1,True
pandas,79278724,Tim Kirkwood,Monkeypatching pandas series to_csv with pytest,0,0,False
pandas,79278065,Hobbit,How to Vectorize Timezone Offset Calculation in Pandas DatetimeIndex for Improved Performance?,1,1,True
pandas,79277936,melca,Indices mismatch during merge in pandas,1,0,True
pandas,79277551,zensei,Pandas read_excel with nrows and skiprows and lazy-loading?,1,0,False
pandas,79276944,Ryanc88,How to separate multiple tickers into individual dataframes with yfinance downloaded data,3,0,False
pandas,79276868,KubiK888,Exception has occurred: DatatypeMismatch column &quot;occurence_timestamp&quot; is of type timestamp without time zone but expression is of type bigint,1,-1,False
pandas,79276761,DaCard,How to convert the column with lists into one hot encoded columns?,1,2,True
pandas,79276647,Stumbling Through Data Science,How do I pass a row to a function using df.apply in Pandas,0,1,False
pandas,79276614,suryansh soni,pd.to_datetime in Temporal activity causes bus error in Docker container,0,0,False
pandas,79276611,Brad,Delete indexed observation based on other column entry,2,1,False
pandas,79276553,Scott Deerwester,Sparse matrix in pandas/scipy with row and column indices,1,0,True
pandas,79275915,Derekhe1988,How to impute OPEN_CLS_STS based on values in DT_CLS,1,-1,True
pandas,79275763,innov-aphp,How to store the result of a datafram grouping seperatly using Pandas Python,2,1,True
pandas,79275607,zard,Creating separate groups in a dataframe when column values repeat,0,0,False
pandas,79275501,Saeed,Manipulation of a Pandas dataframe most time- and memory-efficiently,1,0,True
pandas,79275036,Tumas04,Pandas Dataframe Multiindex - Calculate Mean and add additional column to each level of the index,2,1,True
pandas,79274949,Promise,Python - Pandas matching two json API dumps as dataframes,0,0,False
pandas,79273994,TTY,pandas multi index subset selection,4,2,True
pandas,79273847,Christopher Chen,What role does min value and max value play in reducing memory usage?,1,1,True
pandas,79273734,PTQuoc,Groupby - filling missing component of group,1,1,True
pandas,79273591,Jff,Download and read an Excel file into a pandas DataFrame without saving the Excel file,1,0,True
pandas,79273127,Sjaikisan,Not getting decimals when extracting values,1,0,True
pandas,79272853,Tim Kirkwood,Comparing empty dataframes,1,1,True
pandas,79272800,Alessandro Togni,Rearrange and encode columns in pandas,2,1,True
pandas,79272652,lpca,loop over date range and appending new values to a new data frame,1,0,False
pandas,79272506,Mr T.,how to calculate ratio in group by in pandas,3,1,True
pandas,79271271,TIC-FLY,Fill in rows to dataframe based on another dataframe,1,1,True
pandas,79270671,LSB,Pandas does not save dtype int64 as long in mongodb,0,0,False
pandas,79270607,gracenz,bool and boolean Dtype in Pandas,1,1,False
pandas,79270372,user28311778,"TypeError: Cannot cast array data from dtype((numpy.record, [(&#39;x&#39;, &#39;&lt;i8&#39;), (&#39;y&#39;, &#39;&lt;i8&#39;)])) to dtype(&#39;float64&#39;)",1,0,True
pandas,79269686,bismo,Alternate background colors in styled pandas df that also apply to MultiIndex in python pandas,1,1,True
pandas,79269615,AndysPythonStuff,"How to best use read_csv parameters when headers are on different rows, and then make 1st column datetime index",2,0,True
pandas,79269224,Stephen,force a column of all NaNs to be seen as a string,0,0,False
pandas,79269012,bismo,How to style all cells in a row of a specific MultiIndex value in pandas,1,1,True
pandas,79268880,Mohamad Osama,Change Datetime Frequency in a df Column - Pandas,2,1,True
pandas,79267542,Bogaso,How to get information of a function and its arguments in Python,1,1,True
pandas,79267490,bensw,How to add extra attributes to PyTorch labels?,0,0,False
pandas,79266479,Georg Heiler,Python insert image into cell,0,0,False
pandas,79265786,elaspog,"Using DataSource in bokeh library for color, alpha and other properties",0,0,False
pandas,79264961,user27370924,Transforming a Pandas DataFrame to a New Structure with Specific Columns,0,0,False
pandas,79264751,MPathan,pandas OutOfBoundsDatetime out of scope issue,1,1,True
pandas,79264514,Davide,Data retrieving and SQL database update,0,0,False
pandas,79264451,Daragh,Trying to iterate over different teams in mean data from a larger dataset,0,0,False
pandas,79264424,CHADHA ESSID,Sampling a parquet file with only one row_group,1,1,False
pandas,79263875,Fivomat,How to save values to a CSV file in exponent in python,3,-1,True
pandas,79262610,Gino,Using Pydantic to define AST of boolean expressions,0,0,False
pandas,79262465,William ,How to invert OHLC data?,1,1,True
pandas,79262287,Nic,Pandas : make future.no_silent_downcasting working,1,0,True
pandas,79261896,user28679678,&#39;TypeError: other must be a MultiIndex or a list of tuples&#39; when trying to backtest yfinance data using backtesting,2,1,True
pandas,79261408,Jubilbee Draws,How can I clean a year column with messy values?,2,1,True
pandas,79261395,Karina Meriina,Aggregate function as an argument,1,0,True
pandas,79260787,Sun Jar,Pandas dataframe reshape with columns name,3,0,True
pandas,79260496,hokkaidi,Numbering rows in Pandas without order,1,0,True
pandas,79260240,Armando Contestabile,Pandas Dataframe rolling mean of last 50 daily values differs from rolling(&quot;50D&quot;).mean(),0,0,False
pandas,79258912,Mario,Visualization of ranking models based on time executions,1,-1,True
pandas,79258896,math,How to do an advanced grouping in pandas?,2,1,True
pandas,79258656,anon,"pd.read_csv: error when &quot;,&quot; comma is present in string column",1,-2,True
pandas,79258483,user123892,How to efficiently look for a substring in a pandas df column,0,0,False
pandas,79257905,Regina Phalange,Interpolation of one column in dataframe based on value in another,1,1,False
pandas,79257526,Whitehot,Edit legend of seaborn stacked barplot,2,0,True
pandas,79257488,Kallol,"Create a new line for comma separated values in pandas column - I dont want to add new rows, I want to have same rows in output",0,0,False
pandas,79257418,Samuel Sepeku,How can i change a column data type in pandas without creating null values in the whole column in my dataframe,2,0,False
pandas,79256885,julie,"ValueError Unable to coerce to Series, length must be 2: given 1",2,1,False
pandas,79256801,SerSmile,Pandas DataFrame uses more memory than it claimed,0,0,False
pandas,79256238,Jpdiv,Using Jinja2 Template to Iterate Over SQL Column Sets to Create DataFrames,0,0,False
pandas,79255967,Shawn Zhang,How to create a column of increasing value base on other column with same value,1,0,True
pandas,79255749,Deichgraf,Value Error can only convert an array of size 1 to a Python scalar,1,0,True
pandas,79255590,mrgou,Add columns to dataframe from a dictionary,3,0,True
pandas,79255567,Eoin Vaughan,Pandas check for records for a lag before a certain date range of interest and exclude,0,0,False
pandas,79255551,D Chase,Pandas load json from file and save to excel - ValueError,1,1,True
pandas,79254913,melca,Pandas DataFrame Merge Not Updating All Rows as Expected,1,1,True
pandas,79254302,Gencheeck Yorov,Replacing cell values with a specific one,1,0,True
pandas,79253514,Rajdeep,I want to extract table and its associated columns from a query in Python,0,0,False
pandas,79253409,xsa xsa,python pandas change flip data frame dementions,2,2,True
pandas,79253283,Sharif,Counting the Frequency of Some Words within some other Key Words in Text,1,0,True
pandas,79252313,Patrick,Reassigning pandas columns in chained .assign() gives incorrect values,0,0,False
pandas,79252297,tba,Why does Pandas .floor() throw AmbiguousTimeError for this Timestamp that&#39;s already unambiguous?,1,1,True
pandas,79252245,Bijan,Pandas Filter and Sum but Apply to All Rows,2,2,True
pandas,79252075,user27835988,How to perform conditional rolling aggregations in Pandas with groupby and filter results efficiently?,0,0,False
pandas,79251396,Eoin Vaughan,Pandas Groupby return incremental numbers of groups as new column,2,0,True
pandas,79250785,Will,Testing Atomicity of Delta Tables Using Delta-RS: Unexpected Files Written Despite Exception,0,0,False
pandas,79250681,dlukes,Add custom overload to Python method with existing type hints,1,0,False
pandas,79250500,Sillywumps,Is there a way to type hint pandas column names?,1,2,True
pandas,79249769,Pxndx,Why is the plot of the refractive index wavelength-dependent Fresnel&#39;s equation not showing as expected?,1,2,True
pandas,79249759,navafolk,Searching for string in entire Pandas Dataframe including headers and all,2,1,True
pandas,79248296,badbadllama,Pandas dataframe - combine cell values as strings,2,1,True
pandas,79247594,rafine,euclidian distance from word to sentence after doing Vectorizer,1,1,True
pandas,79247524,Garrus990,How to return a complicated struct out of Pandas UDF in PySpark?,0,0,False
pandas,79247499,badbadllama,Pandas dataframe - finding row comparing two cell values,2,1,True
pandas,79247128,maggie,Pandas pyarrow types and sum aggfunc in pivot tables,0,0,False
pandas,79245819,Sachin,Filter Pandas DataFrame when all IDs are blank,1,1,True
pandas,79245194,Daniel M M,Put specific name on plt.title using DataFrame,1,0,True
pandas,79244236,sad app,Is Using pandas.test() Equivalent to Running pytest Directly?,1,1,False
pandas,79244168,TIC-FLY,Order pandas dataframe rows with custom order defined by list,4,1,True
pandas,79242984,Sandeep Moholkar,"I want to loop through column and add filtered df into template with same format, delete extra rows from the workbook",0,0,False
pandas,79242041,Aswany Mahendran,How to Write a Pandas DataFrame to CSV With Strings Quoted and Integers/Empty Cells Unaltered Without Adding Escape Characters for Commas?,2,2,False
pandas,79240885,Samuel Vranici,How can I reduce the spacing between vertical lines (vlines) in Matplotlib?,1,2,False
pandas,79240830,Niiteesh,Conditionally color dataframe cells in python terminal,2,-1,True
pandas,79240068,Saeed,Problem renaming index value in pandas multiindex series,2,1,True
pandas,79239968,sad app,Request for a method to map test functions to the functions they test,1,0,False
pandas,79239785,NeedBasedLearner,Python Error - IndexError: single positional indexer is out-of-bounds,1,-2,True
pandas,79239719,Anton Mislawsky,Reading integer and float numerical data using Google Sheet API,2,0,True
pandas,79238828,AtanuCSE,Why Print function is splitting my Pandas DataFrame?,0,0,False
pandas,79238707,200 OK,How do I transfer data from pandas Dataframe to a Dataframe variable of a different type,3,1,True
pandas,79238610,te time,determine which columns are equal after pandas merge betwen two dataframes,1,-1,True
pandas,79237858,Scott Deerwester,Efficient access to data in a series of transient Python scripts,1,0,True
pandas,79237626,Humble,Read CSV - There should be a unique row for each daily entry combining health metrics and supplement usage,0,0,False
pandas,79235819,Mohammad,How to access the last 10 rows and first two columns of a DataFrame,3,2,True
pandas,79235310,rth,Efficient SQL query with pandas using databricks-sql-python,2,2,True
pandas,79235198,PTQuoc,Pandas Merge - Elegant way to deal with filling and dropping columns,2,1,True
pandas,79235140,Maxcot,Converting a nested json three levels deep to dataframe,2,1,True
pandas,79234492,Penelope,flattening pandas columns in a non-trivial way,2,1,True
pandas,79233942,fabio-dc,Convert NBB XBRL into DataFrame,4,2,True
pandas,79233242,Qaswed,"How to get relative frequencies from pandas groupby, with two grouping variables?",2,2,True
pandas,79233173,Raf,Format pivot table float format after styling,2,0,True
pandas,79232452,Materia Gravis,Perform a binary op on values in a pandas dataframe column by a value in that same column chosen based on a value in another column,2,1,True
pandas,79231837,THill3,"group by one column, get mode of another, and fill na with that particular mode",0,0,False
pandas,79231771,bazzingaa,How to find missing combination of 3 columns in Pandas given all possible values for each column,1,0,False
pandas,79231240,syed,How to deal with Futurewarning regarding applying Inplace method in pandas,1,-1,True
pandas,79231097,Emi OB,Incorrect syntax near &#39;CAST&#39; when using pandas.to_sql,1,2,True
pandas,79231076,Hendy,"Remove rows of one pandas df using another df, but enable &quot;wildcard&quot; behavior when second df is missing values",2,0,False
pandas,79230796,Colton needs help,Skipping empty row and fixing length mismatch,1,3,True
pandas,79230261,enginexray,Use pandas to turn cell value to column header and show count of that value as new value,0,0,False
pandas,79230035,Nic,Calculate difference between rows in Pandas dataframe using conditional logic,2,0,True
pandas,79228345,chilly8063,Python using oracledb to connect to Oracle database with Pandas DataFrame Error: &quot;pandas only supports SQLAlchemy connectable (engine/connection)&quot;,1,3,True
pandas,79228095,Stephen,Check if specific value in a series is NaN,3,0,True
pandas,79227254,Julio,Shift column in dataframe without deleting one,2,3,True
pandas,79227057,Eseosa Omoregie,How to prevent Pandas to_csv double quoting empty fields in output csv,1,1,True
pandas,79226760,slabbe,For loop in dataframe column,4,0,True
pandas,79226735,henning no longer feeds AI,Pandas replace and downcasting deprecation since version 2.2.0,1,4,True
pandas,79226717,Patterson,Unable to read file in Databricks with Pandas Errror: FileNotFoundError: [Errno 2] No such file or directory: &#39;/FileStore/tables/ge_selection.csv&#39;,1,0,False
pandas,79226461,panicwq,Error when Importing pandas in embedded python in C++,0,0,False
pandas,79226016,bladee,Jupyterlab panel preview pd not defined when on line to import pandas as pd,0,0,False
pandas,79225412,Paul Jurczak,Why this Pandas DataFrame column operation fails?,2,0,True
pandas,79224759,RevOps608,ModuleNotFoundError: No module named &#39;pandas&#39; - I keep getting &quot;kicked&quot; out of my .venv enviornment when running script,1,1,True
pandas,79224129,sds,Why does np.diff handle tz-naive and tz-aware indexes differently,0,0,False
pandas,79223782,kkk,swap one column with a subset of the headers with pandas,3,1,True
pandas,79223637,Soef,Combine two dataframes with partially overlapping column values,0,0,False
pandas,79223398,PeterH,Missing Pandas methods in PyCharm (JetBrains) code completion,1,0,True
pandas,79221977,Tod,Difference between the calculation results of the BackTrader indicators EMA and Pandas.DataFrame.EWM,1,0,True
pandas,79221555,MyNameHere,"For reach row in dataframe, how to extract elements from an array?",2,0,True
pandas,79219732,user2003052,Convert Pandas sales data to pie chart report,1,1,True
pandas,79218810,Alexei Krasnikov,Several outs instead of one while applying a function to df,1,0,True
pandas,79218651,Adhidev A S,How can I efficiently filter and process large CSV files with pandas?,1,1,True
pandas,79218262,Chris,Filter pandas DataFrame by multiple thresholds defined in a dictionary,2,1,True
pandas,79218166,No&#233; Mastrorillo,Determine in which cluster goes a new element with scipy linkage,0,0,False
pandas,79217960,Amina Umar,Plotting cumulative distribution from data,1,1,True
pandas,79217322,Kaden Young,How to convert sqlalchemy datatypes to pyarrow dtype? or sql server datatypes to pyarrow?,0,1,False
pandas,79217260,Veronica,Group by slower after upgrading to pandas 2,0,0,False
pandas,79216200,Graham Tattersall,Linear interpolation lookup of a dataframe,2,5,True
pandas,79215586,John G,Why am I getting this error &quot;Removed Records: Formula from /xl/worksheets/sheet2.xml part&quot; when writing an Excel file with openpyxl?,0,0,False
pandas,79215537,Carl Peterson,Built-in Pandas function for cell-level apply with index/column awareness?,1,0,False
pandas,79212904,sds,Why is tz-naive Timestamp converted to integer while tz-aware is kept as Timestamp?,1,3,True
pandas,79212632,Tw1ster,How to correctly insert in a DF using Python a JSON file which is inside a key in a &quot;father&quot; JSON FILE?,1,0,True
pandas,79212508,Bera,Get the value of a column by max value in others,2,1,True
pandas,79212165,MCornejo,How does Pandas.Series.nbytes work for strings? Results don&#39;t seem to match expectations,1,1,True
pandas,79212130,Rana,How to optimize field calculation for large dataset in Azure Synapse Spark notebooks with cumulative sum?,1,0,False
pandas,79212020,Bill,"How to write a generic Python function that works with Python, Numpy or Pandas arguments and returns the same type",3,1,True
pandas,79211816,X-L,Value based partial slicing with non-existing keys is now deprecated,2,2,True
pandas,79211127,t197453,"Get number of decimals in python float, including trailing zeros",1,0,True
pandas,79210960,Arseni,Use pct_change for DateTime (sub)Index along with group_by for multi-index data frame,1,0,True
pandas,79210902,Tom Smith,Databricks notebook kernel dying when running Pandas aggregations,1,2,False
pandas,79210755,sam 622,strftime() alternating formats for the same placeholder,3,0,False
pandas,79210745,yagmurkoksal,Snowflake ML SimpleImputer does not work as expected,0,0,False
pandas,79209516,Alex Schiff,How do I remove the &quot;data=&quot; from an API response?,1,0,True
pandas,79209316,dkim95,Yfinance returning NaN for first ticker in list,1,0,True
pandas,79209149,swilson,Prevent styler from adding timestamps to multiple date columns in pandas dataframe python,1,0,False
pandas,79208817,No&#233; Mastrorillo,Get a single series of classes instead of one series for each class with pandas in Python,2,3,True
pandas,79208772,goweon,pandas apply multiple columns,2,0,True
pandas,79207848,Christof Bodner,How to calculate with MultIndex?,1,1,True
pandas,79207577,Kumar Sambhav,Number out of representable range: type FIXED[SB4] with Snowflake Python Connector,0,0,False
pandas,79207265,suzanne,Expand a dataframe row into multiple rows based on string conditions,2,0,True
pandas,79207066,Hamza Ahmed,Unable to get all rows from csv based on some column value,0,0,False
pandas,79206663,SM079,Adding values from 2 cells in the previous row in to current row in dataframe,2,0,True
pandas,79205378,quant,How do I plot a line over a bar chart with pandas/date index?,1,0,True
pandas,79204915,Manglu,Allocating orders to resources joining two python dataframe,1,-1,False
pandas,79204622,k1r1t0,How to create DataFrame that is the minimal values based on 2 other DataFrame&#39;s in pandas (python)?,1,1,True
pandas,79204581,Vokult,Map time spent on level based on the date duration pandas python,1,1,True
pandas,79204339,Aaron Horowitz,Pandas Dataframe ffill with Previous Nonzero value in groups,0,0,False
pandas,79204156,Aaron Horowitz,Pandas Dataframe ffill with One Greater the Previous Nonzero Value,2,1,True
pandas,79203402,Sun Jar,Pandas resample stock 5min data not align,2,1,True
pandas,79202081,Long Vuong,"Adding two dataframe columns with a + yield NaN, while using .add(axis=1) works as expected?",1,0,True
pandas,79202065,hoa tran,"How to sum data by input date, month and previous month",1,1,True
pandas,79202026,Brad,Why does my code snippet of an JSON file work but the full JSON load does not,2,0,True
pandas,79201789,Bill,Why does Pandas rolling method return a series with a different dtype to the original?,1,1,True
pandas,79201663,kyrlon,Split columns containing lists from CSV into separate CSV files with pandas,5,1,True
pandas,79201619,NWL,How to change column name marked &#39;0&#39; (zero)?,1,-2,False
pandas,79201413,Joe,Error converting spark dataframe to pandas: TypeError: Casting to unit-less dtype &#39;datetime64&#39; is not supported. Pass e.g. &#39;datetime64[ns]&#39; instead,1,0,False
pandas,79201403,niki,Extracting certain formate data fromexcel using python,2,-1,True
pandas,79201114,Jakub Narębski,flake8 warning for type hints using collections.namedtuple for pandas `itertuples()`,1,0,True
pandas,79200982,user3840530,How to make the ttk treeview not show extra empty columns?,2,0,True
pandas,79200838,syed,Range between min and max values in pandas using lamda,1,0,True
pandas,79200778,Alex G&#252;nsberg,How to calculate cumulative counts for consecutive 0 or NaN values after a condition in pandas?,1,0,False
pandas,79200661,Jesse McMullen-Crummey,Reducing cold start in a python AWS Lambda Function,1,0,True
pandas,79199298,MSPotato,Python Pandas str.extract with one capture group only works in some cases,1,1,True
pandas,79199034,PaleNeutron,How to read a part of parquet dataset into pandas?,1,1,True
pandas,79198926,Prince M,How to Read a Text File and Make Pandas Data Frame,2,-3,True
pandas,79198251,Robert,Changing values over a certain number in a pandas dataframe,2,0,False
pandas,79197989,MarC,Python with Pandas is not reading all records from a bit large CSV,1,0,True
pandas,79197912,No&#233; Staeheli,Correlating two perpendicular frames captured by two perpendicular cameras using trackpy,1,2,True
pandas,79197811,flT,Pandas: how to perform groupby rolling deduplicate sum in an efficient manner?,0,0,False
pandas,79197104,Howard,Difference between &quot;single&quot; and &quot;table&quot; methods in pandas.DataFrame.quantile,1,1,True
pandas,79196629,Mihuu,How to save dataframe after shifting its columns using date as index,1,0,False
pandas,79195896,Phrogz,Correlate columns in two pandas dataframes with varying data types,2,1,True
pandas,79195581,Brad,json normalization record_path key not found,2,3,True
pandas,79195523,lokalhangatt,(ERROR) Select one object and all float &amp; int in pandas groupby,2,1,True
pandas,79194026,Abartel,Trying to create a new dataframe based on group by calculation on an existing dataframe in Python,1,0,False
pandas,79192968,teror575,two columns concat in pandas dataframe,1,0,True
pandas,79192869,joris_94,Randomly shard large CSV into smaller CSVs,3,1,True
pandas,79192792,Karthik S,"How to assign scores to each value in pandas columns based on percentile range, getting `Truth value of a Series is ambiguous.` error",1,1,True
pandas,79192317,Lehel Tompos,Iterate over multiple dataframe and grouped them based on mean value,1,-1,False
pandas,79191312,DarthSpeedious,How to sort python pandas dataframe in repetitive order after groupby?,1,2,True
pandas,79191086,tinfangwarble,statsmodel glm and generalized linear model formula have inversed coefficient results,1,0,True
pandas,79190532,user24123007,Using chunks to upload huge file into lambda,1,1,False
pandas,79190465,Abartel,Pandas calculation not working as expected,2,-1,True
pandas,79190388,crime-brulee,pandas.concat smushes rows together,1,0,False
pandas,79189963,Francis,I am trying import a folder into a jupyter notebook for preprocessing but having some problem assessing the path of the files in the folder,1,0,False
pandas,79189858,Dima Mintsman,pystdf IO method TypeError,0,0,False
