tag,question_id,display_name,title,answer_count,score,is_answered
keras,78728792,Isesele Victor,How to I align my input 0 with my layer dense,0,2,False
keras,78722413,Lukas,Keras ValueError: The layer sequential has never been called and thus has no defined output,1,3,True
keras,78721703,Teresa Wan,How do I define/change the accuracy for a non-classification convolutional neural network?,1,1,True
keras,78719585,Thomas,Keras model input shapes are incompatible with the layer (despite being a compatible shape),1,1,True
keras,78719068,Ali Mustadji,How to visualize predicted samples using my code need more answers,1,1,False
keras,78717341,aabyssx,Keras training speed with PyTorch backend is a lot slower than with TensorFlow,1,3,False
keras,78709319,Md. Mursalatul Islam Pallob,"cnnhistory=model.fit(x_traincnn, y_train, batch_size=20, epochs=500, validation_data=(x_testcnn, y_test)) None values not supported error",0,1,False
keras,78703866,Crystal,How do I map the outputs of my Keras CNN to something that I can understand?,0,1,False
keras,78702337,Vitto,Tensorflow/Keras model raises output shape errors when loaded in another system,0,0,False
keras,78697999,Psykotic,"Tensorflow.keras is not working, what should I do?",1,-2,False
keras,78696299,spool,Issue with training Keras model using ModelCheckpoint in Kaggle notebook (Unexpected result of `train_function` (Empty logs)),1,0,True
keras,78694546,Stephen Lee,"Machine Learning Model on Tensorflow, CUDA, cuDNN not working",1,-1,True
keras,78694533,damian antonio gonzo,Using SAM-LSTM-RESNET,0,0,False
keras,78693872,Kaushlesh Bhalla,Visual Studio Code is not suggesting code completions or syntax highlighting for Keras,0,0,False
keras,78692707,Pratik Ranjan,ValueError: The filepath provided must end in `.keras` (Keras model format). Received: filepath=model/keypoint_classifier/keypoint_classifier.hdf5,1,1,False
keras,78692559,ต้นฝน,Problems using tensorflow,0,0,False
keras,78688232,Jan Hrdina,Is there any way to speed up the prediction of a model?,1,2,True
keras,78686619,Thouseef ulla khan,I am getting this error ValueError: Object arrays cannot be loaded when allow_pickle=False,1,0,False
keras,78683011,Jo&#227;o Santos,Keras 3 Custom Loss Function to mask NaN,1,0,True
keras,78678870,Alex K,&quot;KeyError: 0&quot; when calling model.fit() in Keras,0,0,False
keras,78676463,Lennart Hampel,Error during wrapup: unused argument (grayscale = FALSE),0,0,False
keras,78674714,Felix N,Tensorflow GPU support not working on ubuntu,1,1,False
keras,78670807,Ashwin Singh,model.fit() throwing errors with zipped Datasets,1,1,False
keras,78668638,Vaibhav Shakya,Unable to load MNIST data set due to SSL error in keras...load_data() function,1,1,True
keras,78666998,randomdood1923,Keras model.export() fails because of NoneType shapes in model,1,0,True
keras,78666572,Nikhil Franco,Can&#39;t downgrade Tensorflow Python package to 2.15.0,1,0,True
keras,78663622,neel,How to pass feature value to custom loss in Keras,0,0,False
keras,78662784,Ananya Singh,Why does the Keras Embedding layer result in an &quot;unbuilt&quot; model in the summary?,1,1,False
keras,78660885,harry,Division by neural network; fixed value produced each time,1,0,True
keras,78657967,stevGates,Signal processing Conv1D Keras,0,0,False
keras,78653968,Enes Uğur,Problem in TensorFlow Installation in Anaconda Navigator: LibMambaUnsatisfiableError,2,2,True
keras,78653468,Hasan Cetin,Python Interpreter State Error During Tensorflow Model Training with Early Stopping,0,2,False
keras,78652217,user8916969,Getting a ValueError on loading a custom keras model,1,0,False
keras,78650964,Steven Kelly,Why am I not receiving gradients when training my tf model with a custom loss expression?,0,0,False
keras,78650660,harry,Inconsistency in input shape to neural network,1,1,True
keras,78649712,Omitg,Keras memory leak when using custom DataGenerator,0,1,False
keras,78649700,user8916969,Why am I getting a TypeError while loading a custom model in keras,1,0,False
keras,78649636,Mahesh Maskey,Can&#39;t import KerassRegressor,0,1,False
keras,78647347,Mitch,Trying to concatenate two keras tensors but getting error,1,0,False
keras,78646531,Dr Sokoban,How can I create sequences (windows) from data in a TFRecord?,0,0,False
keras,78643693,Sandra Sukarieh,SMOTE Oversampling in Text Classification Fails with Multiple Input Features,0,1,False
keras,78641151,Ayesha Irshad,Facing issue with Custom Function and Model in Tensor flow,0,0,False
keras,78635866,Jasmine Hung,How to train a Siamese Network with triplet loss using tfa.losses.TripletSemiHardLoss?,0,1,False
keras,78632809,MrT77,Behavior of Model Saving When EarlyStopping Is Not Triggered in Keras,1,1,True
keras,78630597,Los,Error: missing attribute &#39;value&#39; LLVM ERROR: Failed to infer result type(s). occuring while trying to convert .h5 file to .tflite file,0,0,False
keras,78630417,Satarnejad,Evaluating scikit-learn metrics in Keras,1,0,False
keras,78629170,Mas,Adam optimizer updates momentum and velocity differently in eager and non-eager execution (Tensorflow),1,0,True
keras,78626998,john doe,one_hot from Keras producing the same value for different words,1,0,False
keras,78624800,Collins Mwaura,What is the difference between tf.keras.models.Sequential() and tf.keras.Sequential()?,1,0,True
keras,78623480,all.m,KeyError: &quot;Registering two gradient with name &#39;ReduceDataset&#39;! - Tensorflow Keras import error,0,0,False
keras,78619553,kit kat,Keras running out of training data on second epoch no matter how much data i add,1,0,True
keras,78618558,Yidiiiir,Why we can&#39;t use stride and dilation rate at the same time in causal convolution?,0,1,False
keras,78618554,Navix,Tensorflow Performance Drop When Training Sequential Model Using `tf.data.Dataset.from_generator`,0,1,False
keras,78617677,David Magdy,Loading images using Keras for CNN from directory but the images are not labeled in subfolders,1,0,False
keras,78615677,thiendangnn63,"ValueError: Invalid value for attribute `regularizer`. Expected an instance of `keras.regularizers.Regularizer`, or `None`",0,1,False
keras,78615409,atoth96,Wrapping tf functions in layers: model.fit not working,0,0,False
keras,78615219,Weaver,Workaround for removal of add_loss(),0,4,False
keras,78612285,james,AttributeError: &#39;Conv2D&#39; object has no attribute &#39;output_shape&#39; for visualising CNN,0,0,False
keras,78607747,Dr4gon Craft,the get_file() function freezes my script,2,1,True
keras,78607079,mannn35562,How do I get rid of this error and unfreeze the top half of the layers for fine-tuning?,0,0,False
keras,78604978,RPBruiser,keras.utils.get_file() throws TypeError: &#39;&lt;&#39; not supported between instances of &#39;int&#39; and &#39;NoneType&#39;,1,0,True
keras,78604179,Syed Mohmmad Ali Jafri,Getting high loss on the model that I created,0,0,False
keras,78602703,user25508381,TypeError: create_lstm_model() missing 1 required positional argument: &#39;optimizer&#39;,1,-4,False
keras,78600567,Pooty Lim,Why is keras predicting on tensor much faster than dataframes?,0,2,False
keras,78599045,Muhammad Ikhwan Perwira,PHP proc_open with Python script causes UnicodeEncodeError,1,0,False
keras,78598539,Khaled Saleh,cannot import name &#39;path_to_string&#39; from &#39;keras.utils.io_utils&#39; (C:\Users\Hello\.conda\envs\myenv\lib\site-packages\keras\utils\io_utils.py),0,0,False
keras,78597738,Ronny,Working with gradients in tensorflow and keras,1,0,False
keras,78596363,Oliver Schneck,Running Teachable Machines Object Recognizer in PyCharm,1,2,False
keras,78595332,Dtar380,Why does EarlyStopping.stopped_epoch gives one less than actuall last epoch,0,1,False
keras,78584416,Jolly Ehiabhi,"ValueError: Input 0 of layer &quot;conv_lstm1d&quot; is incompatible with the layer: expected ndim=4, found ndim=3. Full shape received: (None, 300, 17)",1,0,False
keras,78578994,Marcus Newman,Convolutional Variational Autoencoder,0,0,False
keras,78578404,Nader Afshar,Custom Metric with Keras without Eagerly execution,1,0,False
keras,78576070,tomasb21,Using Neural Networks Transformer,0,0,False
keras,78572773,Marcus J S Pereira,AttributeError: module &#39;keras&#39; has no attribute &#39;__version__&#39; but when just trying to use ResNet50 (TensorFlow 2.16.1),0,0,False
keras,78572692,axiid 777,how could I resolve Value error between my input and output while running the fit function?,0,0,False
keras,78572327,Hurriande,Batch normalization in neural network for regression task,0,0,False
keras,78571485,christoffer refnov,"ValueError: Input 0 of layer &quot;sequential&quot; is incompatible with the layer: expected shape=(None, 247, 15), found shape=(None, 15)",1,-1,False
keras,78570790,vct12345,Cannot import stuff from tensorflow.keras,1,0,False
keras,78570246,Yassir Hiroli,Error when loading a pre-trained json model,0,0,False
keras,78569816,New_pythonist,How can I install tensorflow and keras for Python 3.10.2?,0,0,False
keras,78568965,justuswolff,Format Logs of .fit() in Tensorflow,1,0,False
keras,78567556,Adwal,Trouble opening images from dataset in Python Keras model,1,0,False
keras,78567516,Liping Liu,keras and tensorflow for R: warnings tf.losses.sparse_softmax_cross_entropy is deprecated and flushing python buffers sys.stderr and sys.stdout,0,0,False
keras,78567000,Barney_Dinosaur,Why does my pruned model have a larger file size than my initial model?,1,0,True
keras,78565881,DoomGuy,"How to interpret training and validation loss graph in Keras, is it a good fit?",1,-1,True
keras,78564783,Rahat Abir,When i try to run model.fit() i face this error. how do i solve it,0,0,False
keras,78564659,Muhammad Abdullah,layers.Dense - AttributeError: &#39;tuple&#39; object has no attribute &#39;rank&#39; &quot;,0,0,False
keras,78562611,SouraOP,Not able to use pickle load() with Keras 3,1,0,False
keras,78562109,B L Praveen,Keras model building get error Cannot convert &#39;51&#39; to a shape,0,0,False
keras,78560045,user25345530,AttributeError when loading keras model after retraining: AttributeError: &#39;Ones&#39; object has no attribute &#39;_set_dtype_policy&#39;,0,1,False
keras,78559968,Heli dhimmar,&quot;Error when deserializing class &#39;SpatialDropout1D&#39; using config:,0,0,False
keras,78559388,Cerno,Warning: Gradients do not exist for variables,1,0,True
keras,78551901,V. MARTIN,model.fit() get error : UNIMPLEMENTED: Cast string to float is not supported,1,0,False
keras,78551681,Alex,Need to convert Keras model to TensorFlow.js but facing version compatibility issues between TensorFlow and Keras,2,0,True
keras,78550985,Aaditya ,Custom train_step() in TensorFlow Keras Model not Printing Values Sequentially,1,1,True
keras,78549890,Mathieu Krisztian,"Why is loss starting to be smooth from version &gt;=(Tensorflow 2.16.0rc0, Keras 3.0.0) as compared to old version (Tensorflow 2.13.1, Keras 2.13.1)?",0,1,False
keras,78545660,AI ML,comparing transfer learning styles for creating model,0,0,False
keras,78545298,sminkopk,Improving CNN Performance with a Parallel Neural Network for Dynamic Weight Assignment,0,1,False
keras,78541790,Anna TOes,ModuleNotFoundError: No module named &#39;keras.wrappers&#39;,0,0,False
keras,78541577,Yanislav Yanakiev,Getting error when trying to import keras-ocr,2,0,False
keras,78540526,carwrxuk,Mask R-CNN: How to infer the shape of Lambda&#39;s output?,2,0,False
keras,78539320,elksie5000,"Error loading kera model ValueError: Could not interpret initializer identifier: {&#39;module&#39;: &#39;keras.initializers&#39;, &#39;class_name&#39;: &#39;Orthogonal&#39;",0,0,False
keras,78536766,user25260259,How can I solve &quot;No file or directory found at ./my_model/model.h5&quot; thrown by tf.keras.models.load_model?,1,-1,False
keras,78536202,A Roebel,How to train a keras model with a single output using two different metrics with different target values,0,0,False
keras,78535919,AyoubLaar,Tensorflow saving model works but loading it doesn&#39;t,1,0,False
keras,78534915,Baaqar Naqi,How can I fix the following import error in Keras?,1,0,False
keras,78530756,inter galactic,error : Only instances of `keras.Layer` can be added to a Sequential model,9,6,True
keras,78527569,Swasthik Shivananda,How to save and load TensorFlow Decision forest model for incremental learning?,1,1,True
keras,78527509,Shree_ML,.predict() in Python gives an Attribute Error,1,-2,True
keras,78525590,Simon,TensorFlow model can&#39;t predict on polars dataframe,1,2,True
keras,78523935,mrtz71,Slicing in custom Keras loss function,0,2,False
keras,78523657,Gocthik,UnicodeEncodeError at / &#39;charmap&#39; codec can&#39;t encode characters in position 18-37: character maps to &lt;undefined&gt;,1,0,False
keras,78514097,Mo McWebmo,Model Accuracy for Non-linear Relationship with Logarithm Kernel and Exponential Activation can&#39;t reach 100%,1,0,False
keras,78513396,MedLearn,Keras/TensorFlow: How to avoid the &quot;OperatorNotAllowedInGraphError: Iterating over a symbolic `tf.Tensor` is not allowed.&quot;-Error,0,2,False
keras,78501026,Snork Maiden,Confusion about training and prediction images&#39; shape,1,-1,False
keras,78498302,Fernando Pujaico Rivera,"keras 3.*, tensorflow 2.16 and keras 2.* compatibility problem",0,1,False
keras,78496961,Jho,How to convert image list and mask list to TensorFlow dataset?,0,1,False
keras,78496946,irowe,keras_cv DropBlock2D does not work in Keras model without eager run,1,0,True
keras,78494513,karesosis,pre-processing sequences for LSTM model (sign language recognition),0,1,False
keras,78493742,Kamali Kinuthia,Feedback manager requires a model with a single signature inference,1,6,True
keras,78493047,Eric Yudi,(Beginner)My AI(U-net) isnt training/testing properly,0,0,False
keras,78492995,MessiSkillz,How would I convert the output of a keras model into a chess move?,1,0,True
keras,78492801,curious_cosmo,How to implement MC dropout in keras?,0,1,False
keras,78490796,Ana Fl&#225;via dos Reis,"(&#39;Keyword argument not understood:&#39;, &#39;adjacency_matrix&#39;) when loading a model",0,0,False
keras,78485236,PHcoDer,TensorFlow Keras compilation successful; still model summary is undefined,1,2,True
keras,78483145,F. M.,Problem loading pretrained hugging face model on Kaggle,0,1,False
keras,78483105,harry,Division by neural network: Cannot take the length of shape with unknown rank,1,1,True
keras,78481939,Viknesh TPK,Why is the accuracy of my Sequential Model in Keras is more than 1 during Epochs?,0,0,False
keras,78480126,Harlequin,3D cropping inside a TensorFlow/Keras model,1,1,True
keras,78476934,Priyanshu,valueerror in Nbeats model from keras-beats,1,3,False
keras,78476711,harry,Neural network to approximate the square function gives 0 output,1,0,True
keras,78475863,NoahVerner,"optree is actually installed but when running &quot;from keras.models import Sequential&quot; it still throws ImportError asking me to install optree, why?",1,0,True
keras,78473294,Faisal Syahruddin,ValueError: Sequential model &#39;sequential&#39; has no defined outputs yet,1,0,False
keras,78472939,Dan,Accessing symbolic tensor values within model or layer call function,0,1,False
keras,78467998,Ivan,Preparation of multivariate time series data,1,1,False
keras,78466591,Dan,Tensorflow input of varying shapes,0,0,False
keras,78464214,yaskovdev,Recurrent neural network trained with torch.autograd predicts nonsense,1,1,True
keras,78463603,Esan Raj,"I am getting a permission error in my code , i am running the code in jupyter notebook and getting this error . Can anyone?",0,1,False
keras,78462808,Whitedevil4648,My test loss is increasing but train loss is decreasing for Neural Network. What should i do?,1,0,True
keras,78462484,Natalia Marszał,Attribute error in densenet121 after 2nd epoch,0,0,False
keras,78462277,firefistt_xdd,"Total params: 0 , on doing model.summary() keras",1,0,True
keras,78461828,Evank,Is it possible to train a neural network to feed into a Random Forest Classifier or any other type of classifier like XGBoost or Decision Tree?,1,0,False
keras,78457321,Jason More,Keras 3 only supports V3 `.keras` files and legacy H5 format files (`.h5` extension). How to fix this bug?,2,2,True
keras,78454705,Vadim,optree ImportError when trying to use tensorflow.keras.models,2,1,True
keras,78454483,harry,Neural network works but erratically,0,2,False
keras,78453713,Zhubarb,TFlite conversion not working for GPT2 model,1,2,True
keras,78453593,Minh Vũ L&#227;,I cannot use tensorflow and keras,0,1,False
keras,78451985,oliver6626,model. fit() doesn&#39;t work when I use class_weight with image segmentation,1,0,False
keras,78450987,Avanish Yadav,ValueError: Unknown layer: &#39;TFOpLambda&#39;,0,1,False
keras,78445083,warren briggs,"While implementing mRCNN, experiencing issue with &quot;No module named &#39;keras.engine&#39;&quot;",1,0,False
keras,78443424,harry,Tile function in numpy not working properly,0,0,False
keras,78439895,Mohamed Waleed,ValueError: Exception encountered when calling layer &#39;gan_model&#39;,0,0,False
keras,78438343,CyDevos,How to solve too many positional arguments after update on Tensorflow using @tf.function on keras custom model?,0,2,False
keras,78438245,oliver6626,model.fit() class weights do not work when training the model,1,0,False
keras,78435000,Harshkumar Mahesh,Both training and validation accuracy is stuck at 50%,1,0,False
keras,78434695,Isesele Victor,How to read into a csv file in tensorflow,0,0,False
keras,78432398,Zhubarb,Keras NLP finetuning dataset incompatibility,1,0,False
keras,78429387,حمدي محمد,ValueError: Unable to synchronously create dataset (name already exists),1,0,False
keras,78425666,deltasata,Proper understanding of Keras implementation of LSTM: how do the units work?,1,0,True
keras,78422215,TheClockTwister,model.fit not recognizing labels in tf.data.Dataset,0,0,False
keras,78420289,ArpitSharma08,Getting ValueError while trying to train GAN model,1,0,False
keras,78414812,GANZA,Load pre trained LSTM model in R,0,0,False
keras,78414478,adhok,How to integrate KeraCV MixUp &amp; CuMix Augmentation into Image Data Generator?,2,0,True
keras,78413637,user3668129,"How to get the output of the model, before the softmax, without chaning the model architecture?",2,0,True
keras,78412765,angryhorse,Mobile net high accuracy but val_accuracy is plateauing,1,-1,False
keras,78409648,qwertzuiop,TensorFlow/Transformers Compatibility Issue: ImportError from tensorflow.keras Causes Failure with TFElectraModel,1,0,False
keras,78408313,angryhorse,Transfer Learning: Image classification High accuracy but very high val_loss. Why?,2,-1,False
keras,78407508,user24799450,Issue with Deserializing a Custom Transformer Model in TensorFlow,0,1,False
keras,78403967,CuriousRabbit,How to save a keras model just for inference?,1,0,False
keras,78401636,angryhorse,Transfer Learning using Keras for Image Classification,2,0,False
keras,78400462,PGT,Keras TextVectorization seems to be case-sensitive even though vocabulary doesn&#39;t reflect this?,0,1,False
keras,78400130,Ali C,ImportError: cannot import name &#39;SGD&#39; from &#39;tensorflow.python.keras.optimizers,0,0,False
keras,78399266,Ali C,"From keras.models, keras.layers and keras.optimizers, Import not resolved",3,3,True
keras,78397891,user15980977,TensorFlow: &quot;Using a symbolic `tf.Tensor` as a Python `bool` is not allowed&quot; error in custom BatchNormalization layer,1,0,False
keras,78396871,Alvalen Shafel,save and load keras transformer model,1,0,False
keras,78394477,Zetland,Why is my TensorFlow script running every line 32 times when executed by a GPU supercomputer?,0,0,False
keras,78393344,MiXen,Error from Keras: ValueError: Must provide at least one structure,3,2,False
keras,78392899,Abby93,How do I solve this on CNN on real image files-creating the model?,0,0,False
keras,78392856,Marcus J S Pereira,"Using tf.keras.layers.AlphaDropout, got: &quot;greater_equal() got an unexpected keyword argument &#39;seed&#39; &quot;",1,1,False
keras,78389096,poldpold,Recurrent Keras model with functional API,0,0,False
keras,78388536,Daniel Elkin,"ValueError: Input 0 of layer &quot;sequential_4&quot; is incompatible with the layer: expected shape=(None, 100, 100, 3), found shape=(None, 100, 3)",1,0,False
keras,78385645,Athul Srinivas,Failed to convert a NumPy array to a Tensor for LSTM,0,0,False
keras,78385506,John Doe Python,Linear regression parameter estimate using Keras,1,1,True
keras,78385031,LocusClassicus,"keras package in R requires tensorflow, throws error",1,0,False
keras,78383064,Ali N,Getting worse results when binary cross-entropy loss is computed from logits in Keras,0,0,False
keras,78381964,Lesim Use,Unable to load model after saving it as .keras,0,0,False
keras,78380993,Tobias Weiland,LSTM dosent learn long term pattern of timeseries,1,0,False
keras,78380804,234,ValueError with tensorflow_hub.KerasLayer in Sequential model during transfer learning,1,4,False
keras,78380728,Harshil Modh,Low Accuracy and High loss while training a neural network model,1,0,False
keras,78380453,Renan Saraiva dos Santos,How to use keras2c?,1,0,True
keras,78378318,user24640442,Does using a for loop with model.fit give the same results as not using it?,0,0,False
keras,78376338,dev,"While training DL model, local rendezvous is aborting with status: OUT_OF_RANGE: End of sequence",1,8,True
keras,78375639,Shamayl,tensorflow.keras.layers.Flatten() throwing INVALID_ARGUMENT error,1,0,False
keras,78375614,MCPMH,"How can I see the array of x, y of batch dataset?",1,0,True
keras,78375602,ac25,Keras EarlyStopping Callback Stopping Condition?,0,0,False
keras,78373468,coolhand,Input shape error when updating pretrained CNN from binary classification to multiclassification,1,0,True
keras,78373215,aureum,Python) tf.keras.utils.audio_dataset_from_directory does not return correct labels,0,0,False
keras,78372798,Chibuike S. Eze,Getting nearly 100% accuracy using Binary Classification in Tensorflow but incredibly wrong prediction levels for email messages,0,0,False
keras,78370305,Zahid Rahman,How to import tensorflow-text correctly,1,0,False
keras,78370063,JimMat,How do you access model.outputs after loading a Keras model from file?,0,0,False
keras,78369198,PSY,How to use labels in an image classification model in google colab,0,0,False
keras,78368726,Никита Шубин,How to set training=False for keras-model/layer outside of the __call__ method?,1,0,True
keras,78367946,MIAN SUBHAN,UnicodeEncodeError: &#39;charmap&#39; codec can&#39;t encode characters in position 19-38: character maps to &lt;undefined&gt;,2,-1,False
keras,78366784,statsman92,Disable all warnings/logging messages from Keras/Tensorflow in JupyterLab,0,5,False
keras,78365926,zappbran,Keras in R / RStudio - Extracting labels from tensor flow dataset,1,4,True
keras,78365586,Atul Anand,AttributeError: module &#39;tree&#39; has no attribute &#39;flatten&#39; while loading Keras model in Flask app (TensorFlow 2),0,0,False
keras,78363599,zappbran,Generate confusion matrix from Keras model predictions in R / RStudio,1,0,False
keras,78362630,P4ts4k,How to fix a TypeError in this tensorflow code?,1,0,True
keras,78362232,Shamayl,U-Net Accuracy is not increasing,0,0,False
keras,78362118,payam,problem between sklearn.model_selection.GridSearchCV and scikeras.wrappers.KerasClassifier,1,0,True
keras,78361650,ThirstyOfKnowledge,Build RNN from scratch with using only Dense layers and Sequential?,0,1,False
keras,78360982,Arpit Goyal,Only input tensors may be passed as positional arguments,1,1,True
keras,78360974,Jonathan,Model predict in keras strange output,0,0,False
keras,78359652,Florin Rotaru,Preprocessing a large dataset with tf.layers.TextVectorization gives Memory Errors,1,0,True
keras,78356775,MCPMH,How to not show INFO:tensorflow:Assets written to?,1,0,True
keras,78356646,BrainlessPOMO,Keras metrics do not work with custom loss function,1,0,False
keras,78355882,Atif Ali,Python Chatbot not Fetching Values from JSON file,0,0,False
keras,78355619,Bruno da Costa,ImportError: cannot import name &#39;ImageDataGenerator&#39; from &#39;tensorflow.keras.preprocessing&#39;,2,1,True
keras,78355384,Anthony ,ResNet50 CNN model won&#39;t fit,2,1,True
keras,78354838,Belter,RuntimeError when using keras 3 with pytorch backend,0,1,False
keras,78354074,Remy Sader,Audio Classification using CNN predicting wrong all the time,0,0,False
keras,78354012,David Kurtenbach,How to handle and convert datatypes in model development in Python?,0,0,False
keras,78353648,le_gabi,"Error during load model, Skipping variable loading for optimizer &#39;adam&#39;, because it has 90 variables whereas the saved optimizer has 84 variables",0,1,False
keras,78351592,user40,Unrecognized optimizer and loss function in TensorFlow,2,0,True
keras,78351360,Osama Abuhamdan,Freezing/Unfreezing Layers in Keras,1,0,False
keras,78351249,Yogesh Regmi,Inputs to a layer should be tensors. Got: &lt;keras.layers.merging.concatenate.Concatenate,1,0,True
keras,78350648,Omar Bouaziz,Saving subclassed model in Keras,0,0,False
keras,78349854,Michael O&#39;Connell,LMST Model sensitivity - Beginners anti-luck,1,-1,True
keras,78348894,Michael Litvin,Simultaneously going over different kinds of data with Keras training,1,3,True
keras,78348286,Eamz,Using Additional Ground Truth For Custom Loss Function Only in Keras Functional API LSTM,1,0,True
keras,78347795,delta_impulse,Convolutional neural network for step/kink identification in 1D data,0,1,False
keras,78346867,zappbran,Keras in R - full list of metrics using compile(),1,1,True
keras,78346712,lakshman,How to use SHAP explainer for explainability of a deep learning model with multimodal input (image and tabular data)?,0,1,False
keras,78345696,MCPMH,Using different backbone network in keras gets error,1,1,True
keras,78344194,Shamayl,Facing an issue while training UNet for Image Segmentation,1,0,True
keras,78343871,Deep,Invalid parameter &#39;model&#39; for estimator KerasRegressor,0,1,False
keras,78339960,Bolofo,Keras tokenizer not appearing in import,2,0,True
