tag,question_id,display_name,title,answer_count,score,is_answered
python,79759075,user9805040,How to properly use swapExactETHForTokens function in a web3py,0,0,False
python,79759062,Phung Hieu Anh,How to automate interactions with a Tkinter app without modifying its source code?,1,1,False
python,79759035,Ery Pisalbon,Not getting IndexError for negative index,1,-1,True
python,79759016,bismo,Change the decimal value of each value in each column to 0.5 while maintaining the same leading integer python pandas,1,2,True
python,79759008,Macklin Entricken,How can I calculate a dash sequence for a line using data coordinates in matplotlib?,1,1,True
python,79758954,Harish,UDS SecurityAccess/SessionControl timing out in Python (udsoncan/isotp) when ECU simulation is in CANoe (CAPL),1,2,False
python,79758951,Aristide,Remove items within pandas DataFrameGroupBy groups,2,1,True
python,79758933,skm,How to efficiently create an array from a list containing arrays of different lengths,1,2,False
python,79758896,Helopiteure,How to generate documentation for multiple files using pydoc,1,0,False
python,79758894,meysam,ModuleNotFoundError for transformers.pipeline after installing PyTorch for CUDA,1,-1,True
python,79758868,Dusan,QGIS headless + Python - exporting PDF with XYZ tiles layer,0,0,False
python,79758809,K_Augus,Does head(n) in Polars agg guarantee alignment across multiple columns within the same group,2,3,True
python,79758806,globglogabgalab,Trying to reduce the verboseness of __post_init__ in a python dataclass,1,3,True
python,79758790,Cammie_28,"Why does pyautogui.write() skip Polish characters like &quot;ś&quot; , &quot;ą&quot; when typing into Windows apps?",0,2,False
python,79758737,carl,Error when trying to access data in h5 file using h5py,1,0,False
python,79758380,Ambitions,How to add objects/links to a set of links in beanie?,1,4,True
python,79758337,Benjamin Ye,Using Sphinx autosummary to generate documentation for class instances stored as attributes during instantiation of another class,0,1,False
python,79758286,user99,how to make graph-tool sfdp_layout behave deterministically for consistent plotting?,1,0,False
python,79758149,Gartenprofi,Bluetooth low energy with calliope mini,0,2,False
python,79758130,DAVE,How can I redirect to the same page after submitting a form using Django and display the submitted data on that same page?,2,0,True
python,79758012,zaber8787利巴,Bot gets &quot;Unclosed connection&quot; when joining a voice channel for the first time,1,0,True
python,79757923,108,Flask Post api not returning created object data as response,1,1,True
python,79757887,Spin,"how can I access particular y and x axis using ax = fig.add_subplot(3, 3, i +1), for a loop on i?",1,0,True
python,79757853,Saeed,Manipulating a large dataframe most efficiently,1,2,True
python,79757682,Evan Hammam,How to correctly generate Nerfstudio transforms.json from drone GPS + yaw/pitch/roll so the point cloud is in geographic space?,0,0,False
python,79757679,Alexander Pyhtin,Incorrect PieceWise result of integration in Sympy,0,2,False
python,79757564,miroslaavi,Nested Window Expression,1,2,False
python,79757518,rian patel,Unable to scrape 2nd table from Fbref.com for players table,3,-1,False
python,79757506,Student,Lean CLI does not show &quot;backtest&quot; command after installation,0,0,False
python,79757417,zddisworkinghard,How can I empty the GPU memory when I get a error like OOM?,1,0,False
python,79757360,Sky Scraper,Fetching live comments on Facebook Video turn names to &quot;None&quot;,0,0,False
python,79757357,angvillar,custom filter for filter_horizontal admin in django,1,0,True
python,79757335,wwwm,Is there a way to use itertools with conditions for sets and arbitrary length?,2,4,True
python,79757282,laserpropsims,"Weird behavior in large complex128 NumPy arrays, imaginary part only",1,4,True
python,79757263,Christopher Pratt,Making numpy array of positions,2,1,True
python,79757210,user1604008,Python unittest fails with No module loaded in VScode,1,0,False
python,79757184,atthegreatestworld,pyttsx3 .runAndWait stops working after first execution,1,4,True
python,79757171,Yahli Gilboa,adding hidden imports in .spec file doesnt seem to change anything pyinstaller,1,1,True
python,79757159,Hank Golding,How to fill in array in row x from columns 0:N where N is part of an np array,1,1,True
python,79757125,TM5,When did numpy change the behavior of A = B[slice]?,2,1,True
python,79757105,Fred DAUFFY,How creating a named destination with pymupdf,0,3,False
python,79757039,Suraj Kattige,Text wrapping in MDButton,0,0,False
python,79757028,Nelson,Pyang can&#39;t display subtree when using &quot;-f tree&quot;,0,0,False
python,79757023,Tom,pqyt6 - How to insert word-wrap in svg content,0,1,False
python,79756942,SeanCCSmith,Queries to Elasticsearch using Python API return different results than Kibana,0,0,False
python,79756936,Irvin Watson,Stepper motor and camera issues,0,0,False
python,79756924,CSe,How can I let `auto_arima` automatically select the optimal seasonal period (`m`)?,0,0,False
python,79756915,dabo_tusev,CheckConstraint in Django model not triggering in unittest.TestCase (AssertionError: IntegrityError not raised),1,1,True
python,79756852,brooklin7,Default text reappears after being overwritten with intended text using Selenium Python,2,1,True
python,79756828,Vasyl Stepulo,Pass python location to Rscript in Azure Devops,0,0,False
python,79756763,Valeria,Python VTK RAM usage,0,0,False
python,79756724,Jules Angebault,How to get the cross-sectional area of a SolidWorks part at a reference plane using Python COM API?,0,0,False
python,79756656,Anton,"An error occured while loading javascript modules, you may find more information in the devtools console (Odoo)",1,0,False
python,79756654,user28238345,After reinstalling Python my program using locals() does not run,2,-3,True
python,79756625,DGMS89,Using a column value to find the Column header name in Pandas,1,2,True
python,79756612,canelle,Mark resources as external/internal with x-tagGroups using python-restx,1,2,True
python,79756594,MikeFenton,How do I capture missing nan values from Pandas 2.3.0 using Pydantic 2.11.7,1,2,True
python,79756578,Akshata,"Docling Hyperlink Extraction Issue : I am using docling to convert pdf to markdown file, but hyperkink not preserved in markdown file after conversion",0,0,False
python,79756546,Engensmax,Pydantic Model with exactly one input out of two optionals,1,1,True
python,79756507,Marco Filippozzi,PySpark ArrayType usage in transformWithStateInPandas state causes java.lang.IllegalArgumentException,1,1,True
python,79756496,Cube Rubik,How to rename a dictionary key and keep the order in python?,1,0,False
python,79756468,Pankit Chahal,Pade Approximation in python with symbolic computation,0,0,False
python,79756455,easterman,Encountering problems while making a sorting algorithm in python 3,0,3,False
python,79756402,user2153235,vobject.readcomponents(...) : Is it a generator or does it *return* a generator?,2,1,True
python,79756369,Asem Shaath,ModuleNotFoundError: No module named &#39;google&#39; in WSL,2,1,True
python,79756235,kurtgn,Why doesn&#39;t MCP server expose my resources?,0,0,False
python,79756233,Ian Burnette,`google.auth` python SDK not reading granted scopes from credentials file,1,2,True
python,79756154,AmericaDoodles,FastAPI route works locally with `/` but not on Vercel (and vice versa),1,1,True
python,79756149,Cillian Myles,"Pandas does not fail, warn, or skip when rows have more columns than the header",2,6,True
python,79756115,user1700890,Installing python package from zip file offline,1,0,True
python,79756105,Fares Dhouib,Pause loop to make a certain action then continue where you left off inside of it,1,-3,True
python,79756072,mazecreator,AI Foundry - Remote MCP Server - Failure: Error - RequiresAction on ToolCall,2,1,False
python,79756066,Connor Irwin,Constant 503 502:Bad Gateway Exception During Audio Syntheses,1,1,True
python,79756013,villaa,"turn Python float argument into numpy array, keep array argument the same",2,0,False
python,79755952,PCuser2009,How to print the tuples in a more user-friendly way,1,-3,True
python,79755894,Saqib Ali,Can I find out if an instance of a SQL Alchemy Model meets the filter requirements without scanning the entire table?,1,1,False
python,79755885,D V,printf (inside C code) called from python in google colab. (no output),1,1,True
python,79755800,user1700890,Downloading &quot;BigQuery_Helper&quot; wheels locally results in error &quot;Multiple top-level modules discovered in a flat-layout&quot;,1,0,True
python,79755748,SLebedev777,Is iteration order of a set in Python preserved until that set is modified?,2,3,True
python,79755665,Kaitlin,Selenium select from dropdown menu,2,1,True
python,79755653,kronos_58,TELETHON Server sent a very old message with ID,1,0,True
python,79755630,Nitroxy,Add a byte after every n-th byte in a bytearray,2,-2,True
python,79755606,MR_Xhao,Syntactically required and semantically relevant tokens in Python grammars,1,-1,False
python,79755548,M a m a D,Why only creating a task will run the coroutine in python?,4,1,True
python,79755527,user26535132,How to merge many nearly parallel line segments into a single density-weighted segment (Python/Shapely)?,1,-1,False
python,79755416,Mayank,Filter Parent class object based on list of child class values in Python | FastAPI | SQLAlchemy,0,1,False
python,79755358,flow_me_over,How to deploy a Databricks App with tesseract-ocr,0,1,False
python,79755351,GenTel,How to have a parent terminal view and pilot a child pseudo-terminal,1,2,True
python,79755340,JIeJaitt,How to retrieve the current conversation ID inside a tool function in LangGraph?,1,1,False
python,79755293,Gumaro Fuentes,"Having issues with openpyxl library of Python, when formating cell as number",1,2,False
python,79755216,frimann,Threading or asyncio for serial communications?,1,2,True
python,79755165,hivegu,Problems handling SSRF vulnerability on api rest request,1,0,True
python,79755156,NotLost,Using multiple masks based on ID,4,3,True
python,79755132,502E532E,Create recursive TypeAlias at runtime,0,0,False
python,79755107,OctSky,"KeyError: &#39;Cache only has 0 layers, attempted to access layer with index 0&#39;",1,1,False
python,79755062,CopyOfA,Best method to create generator for TensorFlow with list of array inputs,1,0,True
python,79754943,Carlos Ochoa,SqlAlchemy: Any way to rewrite models metadata?,0,0,False
python,79754938,emengd,Is there a pure numpy way of performing an operation such as np.min over variable-size bins?,1,3,True
python,79754896,Jose Torres,Modal Popup - Selenium/Python,4,1,False
python,79754864,Huwaiza,Redis OM persistent data issue,0,0,False
python,79754860,laissez_faire,Is it possible to force scipy.optimize.minimize_scalar to look only in the specified interval,1,0,True
python,79754854,chumazik,I can&#39;t upload an image via InputStoryContentPhoto to aiogram3,0,0,False
python,79754732,氢氰酸,Why my Transformer model did not work well when dealing with single cell multi-omic data,0,0,False
python,79754631,May Ochia,ModuleNotFoundError: No module named &#39;pandas&#39; on Raspberry Pi even after installing from requirements.txt,1,1,True
python,79754617,Intolighter,Pyside environment variable doesn&#39;t apply in Pycharm&#39;s run configuration,0,1,False
python,79754606,CopyOfA,TensorFlow data loader from generator error &quot;Dataset had more than one element&quot;,1,3,True
python,79754605,Baps131,Python ElementTree returning empty attributes,1,0,True
python,79754563,Philip de Bruin,How to use a filter expression in PIconnect summary in python,2,2,True
python,79754535,Zeryab Hassan Kiani,Permutation of list in python with one or multiple fixed items,2,-2,True
python,79754470,HouseOfCode,"Is it possible to test concurrent HTTP calls and Firestore side effects in Firebase Cloud Functions (Python, Gen 2)?",0,0,False
python,79754447,Promit Dey Sarker Arjan,Cannot import `QwenForCausalLM` after installing `v4.51.3-Qwen2.5-Omni-preview` tag; pip installs 4.52.0.dev0 instead,0,0,False
python,79754395,user2965433,In PySide6 how to set the QTableView cell font color when in edit mode?,2,1,True
python,79754358,mobidyc,pylance reports access attribute warning while it&#39;s checked,2,0,True
python,79754304,Kathi Meyer,How do I compute validation loss for a fine-tuned Qwen model in Hugging Face Transformers during evaluation?,0,0,False
python,79754286,Santhosh,ModuleNotFoundError: &#39;triton.ops&#39; when loading 4-bit quantized model with bitsandbytes on Kaggle,0,0,False
python,79754246,L&#233;zard,Rotation with Pytorch Torchvision but from two specific angles,2,0,True
python,79754233,Serge Kashlik,How to change order and number of tasks to be executed in airflow,1,0,True
python,79754215,Burnz,Problems with the logic for checking answer in Code Breaker / Mastermind board game,1,2,False
python,79754208,Foton,Dismiss a kivy popup thats created outside the function thats dismissing it,1,1,False
python,79754148,ihdv,How should I install CUDA dependencies in readthedocs build with apidoc autodoc,0,1,False
python,79754004,Sean M,VSCode could not find conda environment: .conda,1,-2,False
python,79753957,Lucio Fernandez,Jupiter lab doesn&#39;t show the image from a jpg file,2,3,True
python,79753854,Lum1te,Trying to loop through a str array and convert elements to integers,2,-4,True
python,79753835,ManBearPigeon,How can I match the token count used by BGE-M3 embedding model before embedding?,2,1,True
python,79753801,Leonardo,Pyparsing ParseResults attributes type hinting,0,1,False
python,79753764,postcardfiction,Find ternary relationships with no duplicates for game scheduling algorithm,1,0,True
python,79753597,Jo&#227;o V&#237;tor Ara&#250;jo,Python 3.13.5 sqlite3 DeprecationWarning persists despite registering custom date adapter,1,4,True
python,79753560,Jokubas11,PySide6 QThread with Worker never emits finish signal,0,1,False
python,79753551,BMac,Why is Airflow Bash operator not passing XCom to another operator?,2,0,True
python,79753483,Niklas,Autodesk APS/Forge OAuth Token Request always returns 404 with both v1 and v2 endpoints (client_credentials grant),0,0,False
python,79753476,miky,How to Run an Open-Source 20B Model locally?,0,2,False
python,79753458,Fabitosh,Configure ruff to ignore environment-provided globals,1,2,True
python,79753424,tiagoams,Is it necessary to recreate conda environments for python on a different version of Linux-64?,0,0,False
python,79753356,grahamstratton,mypy fails with mixed types in variable length tuple,3,4,True
python,79753328,Sandwich,Is there a substitute for ttkbootstrap.Style()?,0,1,False
python,79753309,Alex YAN,Confusion about virtual environment and kernels in jupyter notebook,0,0,False
python,79753276,user90189,Understanding numpy._core module: multiarray,1,2,True
python,79753263,RobBlanchard,Pytest-django database not rolled back with pytest-asyncio,1,1,True
python,79753253,tommiport5,Where should I allocate the pool in Python multiprocessing?,4,3,True
python,79753173,Freeman,Python dev for motion-sensing game using Intel Realsense,1,2,False
python,79753068,Irina,Which way is faster way to create Decimal?,3,-10,True
python,79753057,scrubster,How can I mask unwanted data for a display_bins() function (using pPXF data)?,0,0,False
python,79753050,A-Abe,How to enforce abstract method implementation in chain derived classes?,1,0,False
python,79753007,Nanoputian,High RAM usage when using Datashader with dasked xarray,1,0,True
python,79752914,Aadvik,How can I make all attributes in a Python dataclass optional without rewriting each one?,2,2,True
python,79752854,Ankit Sharma,need help Replicating Stellarium-Style Constellation Maps with Python (Skyfield + Gaia) for given place time and date,0,0,False
python,79752709,Harshaadhithya Kalaikumar,How to enforce per-passenger maximum ride time as a soft constraint in OR-Tools VRP?,1,2,True
python,79752664,SleepingUgly,Error when opening Jupyter notebook from cmd/power shell (Windows),1,2,True
python,79752604,Hal,Pandas continous time periods,4,6,True
python,79752550,محمد مهدی شیخی,Splitting text by new line: &quot;NameError: name &#39;split&#39; is not defined&quot;,2,1,True
python,79752526,shannu_boi,Shallow copying enumeration iterator behavior in Python,1,1,True
python,79752359,Farn Wang,vscode breakpoints in an imported module do not work suddenly,1,2,True
python,79752353,MattQF,Prepared statements not working with Psycopg3 + PgBouncer (transaction pooling),0,0,False
python,79752301,Habib ur Rehman,Getting &quot;Container not found&quot; error when trying to modify GridDB container column definitions at runtime,0,0,False
python,79752222,Paul Jurczak,How to pretty-print a tuple of NumPy scalars?,2,1,True
python,79752205,Something Something,How can I align numpy array outputs from PDFium and stb_image when rendering identical content?,1,0,True
python,79752184,Jason Sturgeon,How can I resolve this Django TemplateDoesNotExist error?,2,1,True
python,79752035,blindcat97,Collision Changed in Kivy Due to Using ScreenManager,2,2,True
python,79751965,Stefan Bongers,"Can a DataFrame have multiple, different types in the same column?",2,3,True
python,79751954,new_coder,"Terminal does not return output, instead restarts code",2,0,True
python,79751895,donbolli,Django enrich QuerySet,1,1,True
python,79751873,Giampaolo Levorato,Combine separate plots into one plot in Python,1,1,True
python,79751781,James Strieter,Why Does Sympy Say This Derivative Is Constant When It&#39;s Obviously Not?,1,4,True
python,79751780,So Few Against So Many,Python function to capitalize the first letter of every word in an input sentence adding unwanted spaces,5,2,True
python,79751771,Hydra,How to sum up a particular row of number inputs in a DataFrame,1,-1,True
python,79751755,Sandwich,Is my tkcalendar clashing with ttkbootstrap?,1,0,True
python,79751727,Pexicade,e2b.exceptions.SandboxException: 403 client does not have permission,1,0,False
python,79751636,Tsquid Tsquid,Shopee API sandbox: error_sign even with correct Test Partner ID and Partner Key,0,0,False
python,79751620,小金貓,How to Check the Actual Type of a Generic Parameter in a Python Generic Function to Narrow All Parameters of Type T,1,1,True
python,79751605,Akash Chaudhari,Installing Python Libraries to Google Drive in Colab is extremely slow or re-installing,1,2,False
python,79751559,user31387630,Big error detected in the electron number of initial guess density matrix,0,0,False
python,79751529,eriknau,splitting a data frame in a way like dealing cards,3,3,True
python,79751503,user9185231,__new__ function behaves differently after overriding it with setattr,1,4,True
python,79751496,sebastian sp,GaiaXPy linefinder installation,1,0,False
python,79751467,ginjaemocoes,Why does flake8 flag E226 only when whitespace is missing on both sides of operator?,2,2,True
python,79751457,Octavio,Diagnosing duplicate inserts after merge/upsert with deltalake (Python),1,0,False
python,79751428,Andr&#233; Lu&#237;s,Problems in running Selenium in EC2,2,0,True
python,79751371,Zilore Mumba,Sorting a column of max values from a multicolumn pandas data frame,1,1,True
python,79751360,Jung Hun Kim,plotly Dashboard refer to different plot,0,0,False
python,79751355,Cappy,issue with creating trading bot,1,0,True
python,79751332,user1867071,My Playwright python script doesn&#39;t find input form fields,1,3,True
python,79751313,James Brian,Beautiful Soup; splitting a paragraph only by &lt;br&gt; where stripped_strings is not working,1,3,True
python,79751265,Anvith V K,"what does shutil.rmtree(d, ignore_errors=True) do?",1,3,True
python,79751257,Eric H.,Python search in a sorted list if key is a part of a string using bisect,1,-2,True
python,79751217,Melendowski,Compute Eigenvalues for matrix when each element is a disjoint array,2,2,True
python,79751214,Rohit Pathak,how to mock assert that my parent decorator is called,0,1,False
python,79751202,user31385194,How can I visualize the segmentation masks predicted by my U-Net model in a Tkinter-based GUI?,0,0,False
python,79751192,raikken zhang,The parallel mapReduce task implemented by langGraph has an incorrect execution order,1,0,False
python,79751147,Luluz,How can I recreate ewm(adjust=False).std() in Pandas?,0,0,False
python,79751135,LucasL,What happens if __del__ is defined as an async def coroutine in Python (CPython 3.12)?,3,4,True
python,79751082,meysam,How to run LlamaIndex ReAct agent with gpt-oss? Getting &quot;SyntaxError: &#39;async for&#39; outside async function&quot;,1,0,True
python,79751060,Harry,How to make a ssh connection from another ssh connected machine,0,1,False
python,79751053,guettli,"Django OneToOneField, Pyright: Cannot access attribute (reportAttributeAccessIssue)",0,0,False
python,79751036,Rockzy 77,Flutter stack overflow error on using python script,0,1,False
python,79751006,orange,Custom numpy element type with arithmetic functions without overloading `np.ndarray`,1,3,True
python,79750977,Alu,Flask ML App Stuck on &quot;Loading&quot; Status Despite Successful Model Training,0,0,False
python,79750913,Satoshi,"Hosted script is being blocked by external webs on requests, but they can be done locally",0,0,False
python,79750907,Jian Rao,"PyCharm remote SSH + Conda interpreter works once, but disappears after restart (&quot;Nothing to show&quot;)",0,2,False
python,79750880,user12727685,MSAL python OBO authorization flow gives error AADSTS90014: The required field &#39;iss&#39; is missing from the credential,0,0,False
python,79750850,BTBeinj,How do I get predictions from my CatBoost models on Raspberry Pi using Python?,0,1,False
python,79750830,Daniel,Max throughput in Python WebRTC data channel capped at ~110 Mb/s for large file transfer,0,1,False
python,79750814,bardulia,Xwayland gradually consumes all RAM when running tkinter + matplotlib + RPI Connect,1,2,True
python,79750812,Phrogz,Creating git subtree repo that can import Python files as from &quot;fake&quot; namespace,1,6,True
python,79750742,umyBx4,Kumaraswamy-Laplace Distribution using scipy rv_continuous,2,1,True
python,79750735,Aadvik,How to use the data class itself as the type of its attribute,0,0,False
python,79750725,AL-zami,Variable type-hinted to to be a dictionary that accept list as value is also taking sets as valid value,1,-2,True
python,79750684,Steve Jorgensen,How to detect pipe close when reading text by line in Python,1,1,True
python,79750682,jcfaracco,Is it possible to install submodules of a python package dynamically?,1,-2,False
python,79750629,Yuli,"When Altair saves plot with save, it loses some configuration parameters",1,1,True
python,79750620,AndyB,Cannot successfully create the simplest LibreOffice extension for UDF&#39;s,0,0,False
python,79750548,MivaScott,"Using PyTest and Playwright, run one method before loading all the test files",1,1,False
python,79750438,oyster,ragas with Ollama does not terminate,0,1,False
python,79750411,lilith,Seaborn heatmap with a logarithmic colorbar with each color resembling one order of magnitude?,2,3,True
python,79750369,benzkji,"Pycharm recognizes package installed with -e (editable), but does not recognize/show the package content",1,2,True
python,79750354,thor,Pandas merge one-to-many,2,0,True
python,79750317,Santiago Lorenzano,Prevent Reflex (Using Alembic) from generating migrations of existing tables in the database,0,0,False
python,79750217,chris_cm,How to make Numpy.where() return only the first match?,3,3,True
python,79750144,Frank William Hammond,Type-annotating function with generics that I don&#39;t care about,3,5,True
python,79750095,Nabodita Gangully,Cannot make tkinter horizontal scrollbar lie flush against listbox,1,1,True
python,79750069,Engensmax,Sequence of child classes requires empty instantiation,1,1,True
python,79750041,Lisa Nagel,drop.na code doesn&#39;t show up when using print(data_frame),1,-2,True
python,79750038,carl,SyntaxError in flask_humanify,2,2,True
python,79750033,FBruzzesi,polars `write_parquet` to S3 with partitions makes local copy,1,2,True
python,79750003,carl,python module not found after installation,1,0,True
python,79749945,marco,Python - ThemedTKinterFrame - grid_columnconfigure weight does not work,1,1,True
python,79749880,ludovico,How to specify the values of an union in a type hint?,1,2,True
python,79749841,PGHE,How to get the MCPO Proxy command working correctly,0,0,False
python,79749829,Abhishek ,How to do linear interpolation in PySpark without Pandas UDF (only using Spark API)?,1,2,False
python,79749806,Ziur Olpa,How to typehint functools.partial classes,1,3,True
python,79749799,Abbye,Why is my list not updating inside a function in Python?,3,-4,True
python,79749770,Despicable me,Pandas read_csv: Skip rows contains invalid data that can cause data_type parsing errors,2,2,True
python,79749646,CopyOfA,Create unique index for each group PySpark,2,1,True
python,79749636,Kaia,Redirect stdout at a file-descriptor level to silence noisy module import,3,5,True
python,79749632,Andrea Buscetto,CtkButton doesn&#39;t load images correctly,1,-2,True
python,79749620,Rory Coble,Python in a Docker Container refused connection to Postgres in a networked Docker Container,1,-2,True
python,79749580,Brian A. Henning,How to retrieve one data value from the result of a pandas DataFrame.groupby().mean(),2,2,True
python,79749559,Dillon H,Why won&#39;t VSCode Smart Send my Python code line by line to the terminal as it used to?,2,3,True
python,79749547,Javier Olivares,calling a class object in an iterative way on python,1,-5,True
python,79749522,Despicable me,"Pandas read_csv, load empty/missing column values as NaN while loading empty string for quoted empty strings values in csv file",3,3,True
python,79749411,wjandrea,What is NaT in Pandas?,1,2,True
