tag,question_id,display_name,title,answer_count,score,is_answered
python,79832937,Marcos Ferreira,Any ideas on how to make this more efficient?,0,-4,False
python,79832936,user31953276,&quot;IndexError: list index out of range&quot; when accessing 5th element of array of 3 items,0,-2,False
python,79832926,Phant,mypy complains about a missing optional module,1,1,False
python,79832908,Robert Chaney,how to create a new client connection FROM the Server-side using python socket programming?,1,0,False
python,79832867,workercat,Having trouble with an assignment that involves processing tuples containing a str and a set of integers,1,-5,False
python,79832860,dumbass,How to define an alias value for an enum member?,1,1,False
python,79832716,SRJCoding,Databricks - How to restrict the values permitted in a job or task parameter?,0,0,False
python,79832681,Vanshat,Why does Python’s sorted() ignore my custom __lt__ method when sorting a list of objects?,0,-6,False
python,79832672,student13,Good packages for bounded Linear Quantile Regression?,1,0,False
python,79832664,lad12345,sqlite3.OperationalError because Python thinks my table name is a column,0,-2,False
python,79832539,Nick,How to solve CAPTCHA using Python when doing automated scraping,1,0,True
python,79832520,Sea Jay Amos,CSV data not outputting from list comprehension after record count (for loop),0,-2,False
python,79832507,gaut,How to show the streaming parts of a polars query using explain()?,0,1,False
python,79832464,Karan Singwal,Why is my LLM hallucinating even after using a multi-vector RAG pipeline with FAISS?,0,-8,False
python,79832402,Xingrui Zhuang,"How to read a large Python project (for example, a project of Deep Learning or Reinforcement Learning)",1,0,False
python,79832391,Adrian Straker,How to randomly select a pixel within a kernel and attribute its value to the center pixel?,1,-1,False
python,79832252,Tom Grundy,Fn-F6 is not received by python script when Fn-lock is disabled,0,-2,False
python,79832203,Yuxi L,InterpreterPoolExecutor vs ProcessPoolExecutor,1,1,True
python,79832178,link89,Keep conda environment of parent bash session when start a new bash session,2,0,False
python,79832143,saul ye,Best way to extract a names from a string,1,-4,True
python,79832134,Amira Yassin,"Optimization Challenge in Hugging Face: Effcienntly Serving Muliple, Differently Sized LLMs on a Single Gpu with PyTorch",0,0,False
python,79832122,Sam Jaques,Python venv command failing on MacOS with Homebrew,1,0,False
python,79832111,Luminescent,One long PDF page generation,0,0,False
python,79832098,Ricca,How can I set up an ETL process for DataFrames (dbt or alternative tools)?,0,0,False
python,79832057,Georg Plaz,Negative narrowing of union type with TypeIs of TypeVar not working as expected in new mypy version,0,0,False
python,79832002,knipknap,Is there any way to use theme colors in a Gtk4 DrawingArea?,0,0,False
python,79831990,Gjyslaf,Issues with tuple comparison while using a specific class that bypasses comparison,1,0,True
python,79831980,Freisei,kivy widget draws on root instead of widget place,2,0,False
python,79831977,Tom van G,Efficiently coercing a Python list to a Numpy array with a custom datatype,1,3,True
python,79831920,Amoin Marl Mikko,Jacobi Method on Python stopping at 3rd iteration,0,1,False
python,79831905,Tuhin Shaikh,How do I prevent two VWAgent workers from deadlocking when they face each other after task assignment?,0,0,False
python,79831895,Rahul Chakraborty,Why I&#39;m getting blank nullcline plot?,0,0,False
python,79831868,Emad Deve,How can I create a tool for langgaph&#39;s agent to save data in db?,0,0,False
python,79831852,s5s,OrderedDict ordered by most recently used element,1,1,False
python,79831827,Debottam,DuckDB connection.execute from fast api code changes &amp;( to amp;( in a read_xlsx query,0,0,False
python,79831743,mike,How to display a lot of line_strips efficiently with ModernGL,0,0,False
python,79831728,GYA007,My custom label&#39;s text is uneven when rotated,1,2,True
python,79831663,Tim,How to implement a callback using PyCall?,1,0,False
python,79831600,Billy Pilgrim,Use pandas merge_asof to achieve inexact left join,1,3,True
python,79831565,CALTON,Как подключить python скрипт к базе данных mysql на phpmyadmin?,0,-2,False
python,79831527,Max__08,Loading many PyTorch .pt files from Google Drive in Google Colab is extremely slow,3,1,False
python,79831483,Kilometer Bob,404 on certain files on select devices after repeated visits,0,1,False
python,79831464,alo bre,Passing 4 arguments to a jit function with 4 parameters raises TypeError: jit() takes 1 positional argument but 5 positional arguments,0,-1,False
python,79831405,sandeep gajula,Fastest way to read 10M DB rows in Python?,5,3,True
python,79831340,user3126352,How to specify docstrings as formatted strings,1,0,False
python,79831320,Gabriel Gattini,I&#39;m having trouble starting to build my Dockerfile to deploy on Railway,0,-1,False
python,79831311,Krishnendu Dutta,To Run firefox browser using launch_persistent_context of playwright python,0,-2,False
python,79831290,Mauricio Reisdoefer,How can I validate recursive Pydantic models where the validation rules depend on dynamic nesting depth?,1,2,True
python,79831183,Sherwin R,Linking custom sqlite when building python,0,2,False
python,79831172,AP_,"pyinstaller is just outputting a generic file, not an exe",1,2,True
python,79831166,Mathieu,Building a streamlit app that can be run simply with &quot;uvx [package-name]&quot;,7,1,True
python,79831159,Capeya,Check if request.json() is NoneType,8,1,True
python,79831132,Ivan,What does &lt;string&gt;:2(__init__) have to do with mathematical computations?,1,2,True
python,79831130,Supratim Ghosh,"What does the yield keyword do in Python, and when should I use a generator instead of a list?",2,2,True
python,79831093,superblowncolon,GCP API Response: Control Characters Forbidden: Invalid encoding,0,0,False
python,79831089,Leopold,Is passing the same value to a function twice bad practice?,5,1,True
python,79831082,Renox134,How to add an Expansion Panel within an Expansion Panel in kivymd?,0,0,False
python,79831023,new coderrrr,"CSV test failures started after adding rows, likely due to an encoding issue",0,0,False
python,79831013,Louis Chua,What is the correct NumPy representation of a row vector for gradients,1,1,True
python,79830942,Chlamy,Unrecognized arguments on Python with PyInstaller and argparse,0,-1,False
python,79830911,Henrik N&#248;rgaard,ModuleNotFoundError: No module named &#39;source_salesforce&#39; when using AirbyteSalesforceReader,0,5,False
python,79830899,Matteo Pozzi,PySide6 import error: DLL load failed while importing QtWidgets,0,2,False
python,79830864,Suyash Anand,Is there any significant difference between 0ms and 4ms (in leetcode)?,0,-4,False
python,79830849,monteis,Run JavaScript in Python wrapper: problem by module calling,0,1,False
python,79830823,Bhumika Aggarwal,Why does groupby().apply() produce inconsistent results on identical groups when the DataFrame has overlapping indices?,0,0,False
python,79830815,Kan,Using list to find variables from data in rows,1,-1,True
python,79830796,yossi l,How to let people into rooms in oop python,0,-8,False
python,79830778,Shankboy,Nodriver does not take exception if element not found?,1,3,True
python,79830774,Quốc Tiến Trần,YOLOv8 custom training loop using v8DetectionLoss fails to converge on custom dataset (7 classes),1,-1,False
python,79830739,michael,How can I merge multiple lists into one without keeping duplicates?,1,-2,False
python,79830732,Pantea,MongoDB to Oracle insert runs in reverse date order,2,2,True
python,79830711,souLLe,Python can&#39;t run multiprocessing while containerized,0,0,False
python,79830707,user30659876,I am implementing an AVL Tree in Python. I have two modifications I want to make:,0,-4,False
python,79830688,dikesh,Polars parse multiple datetime format,1,1,False
python,79830685,tuserun,"If I subclass int, how to make arithmetic methods return the derived type?",3,0,True
python,79830666,adarsh verma,Speed up LangGraph REACT + RAG.(Multi-Agent Chatbot),0,0,False
python,79830653,derM,Caching derived properties of typing.NamedTuple,2,-2,False
python,79830599,Goran Nikolic,Get last line text,1,-8,False
python,79830597,radical_radiodont,How to do Moran&#39;s I for set of coordinates with space inbetween?,0,-1,False
python,79830538,Ashark,Why argparse treats unknown arg as a known arg in case unknown arg name is part of a known arg name?,1,1,True
python,79830528,Sandepku,SSH Library Robot framework - remote python script execution,2,-1,True
python,79830513,Preksha Parekh,"How to categorize small/local company names into sectors (Tech, Industry, etc.) when they cannot be found online?",1,0,True
python,79830507,AP_,How do I make a matplotlib bar graph scale with the amount of items?,1,1,True
python,79830434,eric feng,"task works on local, but errors on Dask cluster: &quot;SystemError: error return without exception set&quot;",0,2,False
python,79830421,PRANAV K P,FastAPI WebSocket + Kafka: Only the last connected client receives messages,0,0,False
python,79830404,Risho Enr,Why does my Python function return None even though it executes without errors?,0,-9,False
python,79830400,nishio ken1,wsl: Permission denied on using pyenv,0,0,False
python,79830372,Ongky,QTableview in PySide6 calls data() multiple times for rows that should not be visible,0,1,False
python,79830355,Factor Three,"Installed bcrypt with pip in a docker container, but getting ModuleNotFoundError",2,0,True
python,79830321,Harneet.Lamba,Python list of tuples while iterating unable to see an element but when printing it can see the element,0,-1,False
python,79830244,Stevoisiak,How can I make a square Tkinter Entry widget if width only accepts integers?,2,1,True
python,79830183,Clodoaldo Neto,Plotly Dash dbc column width,1,-1,True
python,79830106,Akira,polars.LazyFrame.sink_csv does not give CRLF line termination,0,0,False
python,79830100,user28348051,Best way to clean awkward Excel column headers in python/pandas?,3,1,True
python,79830073,Stuff,Placing text box next to text in tkinter,1,0,False
python,79830072,Emby,"Beautiful Soup, children are clearly inside but can&#39;t get it",2,0,False
python,79830067,Rusalina Begu P-2212,How do I reproduce this CRC32 logic from assembly,0,-7,False
python,79830059,tsuckow,Enforce __init__ method&#39;s arguments are superset of base class,2,2,True
python,79830027,Stefano Munarini,DuckDB in lightweight incremental Foundry transform,0,0,False
python,79830000,Harsh Mishra,Python time-interval check returns None when two lecture intervals share the same boundary time,2,1,False
python,79829954,maxi,UPS fuel surcharge history extracting,0,0,False
python,79829917,Dario,Slow collision detection in Python,0,-2,False
python,79829898,toben aus,How to split dataframe into multiple sub-dataframes based on column value,4,2,True
python,79829880,Andrei,How does Python decide whether the last part of an imported name is a module or a function?,2,4,True
python,79829859,Anton,Numpy handling small imaginary parts differently,3,2,True
python,79829854,jac,DTLS handshake fails with &quot;no SRTP profile negotiated&quot; when streaming from ffmpeg (schannel) to aiortc WHIP server,0,0,False
python,79829842,KaranSRMA,Can a React (Vite) SPA prevent a component from being included in the client bundle until after backend authentication?,0,-1,False
python,79829825,Faraz,DB2 CLP command via subprocess.run sometimes returns empty output and sometimes SQL1024N: A database connection does not exist,0,0,False
python,79829824,PRIYESHI,What is the difference between Python list and tuple?,0,-4,False
python,79829723,Deeksha Nagesh,OpenAI API Key Being Leaked Even Though It’s Stored Securely on Server . Need Help Diagnosing,0,-3,False
python,79829701,Ridit,How can I efficiently map and update frequencies of nested items using dictionaries in Python?,1,0,True
python,79829682,Просто Аккаунт,how to fix this problem with pydantic core,0,0,False
python,79829648,Saguro,Sub-connection to secure main connection,0,0,False
python,79829546,Jml,Raman spectral data format for MCR-ALS,1,1,True
python,79829532,J_M,CV2 not able to identify the valid numpy arrays,2,0,False
python,79829521,user31922730,"If I do a magic command, %run file, does that run the script as main? If so how do I get around this?",1,0,True
python,79829472,wonone11,PyTorch installed via uv project shows CPU-only version on Windows with CUDA specification in pyproject.toml,0,1,False
python,79829421,Giggabite,How do I make a custom field output different datatypes depending on file asking for data?,1,2,True
python,79829347,Sergio Souza,libpyjini.so not found - White screen on smartphone,0,0,False
python,79829330,Smruti Ranjan Sahu,"API request tracing with NextJS, Nginx and Django",2,0,True
python,79829317,jyotish,Why is explicit Parent.__init__(self) discouraged in Python Multiple Inheritance compared to super()?,0,-3,False
python,79829221,Venkat Nikhil,How to run nsjail on Google Cloud Run without prctl() errors?,1,0,True
python,79829204,Akira,Polars: how to write a column of strings into a txt file without escaping?,3,1,True
python,79829146,Mordechai,Adding a default path as an option in Typer,0,0,False
python,79829119,Liz W.,python-docx: Sections with numbered lists as content,0,1,False
python,79829111,Cesare Brizio,Grouping landmak vectors by similarity (Python or R) - which is the simplest solution?,1,1,True
python,79829106,Alireza Khalaji,SSLCertVerificationError when fetching OpenML datasets in conda environment on Ubuntu,0,0,False
python,79829104,Lee Hoyland,How can this code make me look better as a programmer,7,0,True
python,79829103,Long Nguyen,SQLAlchemy and partitioning table,1,0,False
python,79829088,pixeldrift,Freeing memory to OS after heavy function without forcing GC,1,2,True
python,79829061,Reza Hosseinzadeh,future module in debian,1,-1,False
python,79829053,Ibrahim Ali,Billing during idle time,0,1,False
python,79828952,HanSooloo,Combined Pydantic settings class from multiple settings classes with individual environment files,2,2,True
python,79828864,WolfiG,Multiple variable/correlation analysis using Python,1,2,True
python,79828854,Jenna Domek,How to remove todo checkmark from Spyder?,0,-2,False
python,79828828,epi,Python Customtkinter: Getting real widget size,0,1,False
python,79828814,jbosch,What causes extra subprocesses to be created by Python multiprocessing?,0,0,False
python,79828812,Minimo,Add an instance to a virtual subclass?,4,1,True
python,79828728,Philip Adler,subprocess.Popen wait doesn&#39;t seem to wait for Google Chrome on macOS,1,2,True
python,79828671,Mukta ,Attribute error: &#39;open3d.cpu.pybind.geometry.PointCloud&#39; object attribute &#39;points&#39; is read-only,0,0,False
python,79828650,isgotkowitz,How to enable endpoints with optional authentication using the Litestar framework,0,1,False
python,79828636,rashad,Segments too short for OpenSmile feature processing,0,1,False
python,79828591,Larisa Palimaru,"Extracting decimal and negative numbers from PDF, where decimals look like exponents in the PDF",1,3,True
python,79828567,Newbyte,Are there any advantages to having mypy check only your entrypoints in your Python program versus every single file?,3,0,True
python,79828564,Pablo Pamies P&#233;rez,How to get Test Suite ID and Test Plan ID in the same dataframe as the Test Case ID?,0,0,False
python,79828554,Ted,"Open Vim with text in it, without saving the file",4,1,True
python,79828500,user2473664,new ciscoconfparse2 does not have the gobal delete_lines anymore. alternative?,1,1,False
python,79828485,Decoder,ModuleNotFoundError: No module named &#39;webdrivermanager&#39; with Spyder,0,1,False
python,79828467,Noob student,Communicate PLC FX1N with Python,1,0,False
python,79828378,Manuel Schmidt,Monitor `asyncio.create_subprocess_exec` pipes for errors,1,0,True
python,79828359,Sandepku,PywinAuto API - child_window - returning multiple elements,0,2,False
python,79828342,K Vinay,DocuSign Sandbox: “ENVELOPE_ALLOWANCE_EXCEEDED” After 114 Envelopes and Trial Account Cannot Create Integration Key,1,-1,True
python,79828267,aadidev g,Python - updating CSV file,0,-3,False
python,79828241,Comic Hell,How to make a Pydantic field conditionally required based on another field?,2,0,True
python,79828223,Alex Cornford,How can I center the Input fields? The method align_horizontal does nothing,3,1,True
python,79828217,Comic Hell,How to pass variables to a template HTML with Flask,1,3,True
python,79828213,GINzzZ100,PicklingError: Could not serialize object: RecursionError in pyspark code in Jupyter Notebook,1,1,False
python,79828200,Mike T,How to resample timeseries with origin aligned to start of year,2,5,True
python,79828138,Juha P,Analysis of a tapering function,2,0,False
python,79828137,Stuff,text moves vertically when exiting text boxes in Tkinter form,0,1,False
python,79828131,Archimedes Trajano,How do I get around a typing issue for execute_workflow in PyCharm,1,1,False
python,79828125,Lost_Soul,How to pass around scipy fit results and corresponding functions,1,0,False
python,79828115,Kevin K,Metashape Python lat/lon to local coordinate center problem,0,0,False
python,79828107,Noah P,tnmaccess api not returning results,0,0,False
python,79828094,acortis,Is there a way to stream ollama chat into a Marimo ui?,0,0,False
python,79828088,Jacob Shishkin,Why does my code say break outside loop when it is in the while true/if: statement?,1,-6,True
python,79828082,Shai Berger,How to port tox legacy-ini with factors to native toml?,2,0,False
python,79828079,Ingrid Ledingham,Tkinter image will not change,1,0,True
python,79828026,Eric,How to automatically convert from Python 2 to 3 now that 2to3 is removed,3,0,True
python,79827990,Cutter,How to write bytes as a b&#39; string to a file?,4,0,True
python,79827970,Samyar,get the data from the server with fetch API,0,-1,False
python,79827905,marstensid,I get a following import error: ImportError: libssl.so.3: cannot open shared object file: No such file or directory,0,0,False
python,79827724,Kyle Campbell,URL Targeted web crawler,0,0,False
python,79827697,Dominic ,"Looking for proportion of prime numbers in a list, error in code",2,2,True
python,79827694,Curious Learner,How is Datadog able to collect trace data without any modification of application code?,0,0,False
python,79827677,Mohammed Baashar,Error: &quot;&#39;utf-8&#39; codec can&#39;t decode byte 0xd6 in position 4: invalid continuation byte&quot; when trying to open .wav file,1,0,True
python,79827673,Rhys,subprocess cannot use stdout with CREATE_NEW_CONSOLE on windows,1,0,False
python,79827671,Paul Gibson,"Using Tesseract OCR with Docling PyTessBasseAPI call fails, won&#39;t init",1,0,True
python,79827652,Maj mac,Tkinter ttk.button background is leaking color outside the button border,1,0,True
python,79827650,youtube,Unsupervised Time Series Segmentation Without Predefined Number of Segments,1,0,False
python,79827634,Nukesub,Can&#39;t Import Module with Python Package with Subpackages All as Zip Archive,1,1,True
python,79827587,Robin Šk&#225;ba,Get cookies from Chrome while it&#39;s instance is running on Windows in python,1,0,False
python,79827328,Rishabh Kumar,How to sort a dictionary of word counts by value while preserving the original key order?,3,2,True
python,79827258,KeDo 2517,How to reverse-engineer an undocumented proprietary Raman spectroscopy binary file format (.jws)?,0,0,False
python,79827203,cmasupra,Discord.py logging in multiple times when restarted,0,1,False
python,79827133,Josep,Noiseless Gaussian Process Regression not crossing the training points,0,0,False
python,79826983,v0id0100,How can I update a text name on a label on Tkinter:,3,1,False
python,79826962,VIK,Why are rows returned as stale when fetching TimeSeries data with multiple sequential queries on the same RowSet?,0,1,False
python,79826956,ToridFartFart,How do you make an algorithm that&#39;ll find the shortest way to sort a sequence of numbers by applying function that converts to closest lower prime?,0,-4,False
python,79826943,rainerpf,Why does a nearest join_asof() return exact matches despite allow_exact_matches=False?,1,2,True
python,79826932,Margot Sibson,How to Create a Pandas Dataframe from JSON Nested Objects,2,0,True
python,79826836,Utkarsh Mishra,Why does my Python solution for selecting 2 points from each interval give incorrect results for overlapping intervals?,1,2,True
python,79826779,Ad Du,My Code With Openrouter api is not working,1,-2,True
python,79826775,v0id0100,How can I save a local file using tkinter with filedialog.askopenfilename,1,2,True
python,79826609,FLKR,Running a tool with uvx from a private repo using an access token,1,1,True
python,79826605,Dawid Maślanka,What is the recommended way to extend Python modules with custom functionality without modifying source code?,0,-2,False
python,79826604,GhostCat,How to replace a Twine upload with uv publish?,0,0,False
python,79826597,Tasos Paraskevakis,How can I classify sitemap URLs (WooCommerce / OpenCart / custom ),0,0,False
python,79826593,Tiago Silva,Detecting human presence in a WhatsApp chat to pause a chatbot (Python),1,2,False
python,79826490,ventolin,Django: Separate session expiry times for &quot;normal&quot; website and admin area,1,0,False
python,79826446,ninivert,Chapel-Python interopability - export records (or interface with Python dataclasses),3,2,True
python,79826418,Benedict Summers,OpenAI deep research API structured output,1,-1,False
python,79826375,jiwei zhang,"pytorch Module B=A, A.to(&#39;cpu&#39;), but the tensor in B is still in GPU, why?",2,1,True
python,79826360,Rub&#233;n Sales Castellar,Python library recommendation for the implementation of a neural network modification algorithm,3,1,True
python,79826350,Royy,"Trying to make it CTk, but STATE not working",3,0,False
python,79826179,George Weiss,Why does VS Code sometimes say &quot;trust this notebook&quot;,0,-3,False
python,79826169,hackerb9,How to search through Unicode text with ASCII input in Python,4,0,True
python,79826164,alinader1371,How to store and match user-selected words with their different forms across texts?,0,-3,False
python,79826095,Trishan Karmakar,How to apply Tkinter (python) into Html base format,0,-6,False
python,79826051,Cutter,How to import an editable package?,7,0,False
python,79825951,WGroleau,python3.14 returns error but output is still correct,4,0,False
python,79825930,Shakti Sourav Swain,Flask/Jinja2 Error: Custom Template Filter Not Found,0,-2,False
python,79825880,Ir0nic,How to prevent session timeout in Python,0,-1,False
python,79825864,Caroline Pickett,For Meshtastic Python API,0,-1,False
python,79825818,Rael Clariana,PyTorch fails on Windows Server 2019: “Error loading c10.dll” (works fine on Windows 10),1,2,True
python,79825743,Engensmax,Pylint `arguments-differ` not applicable to constructor of a child class,1,1,False
python,79825741,Pynchia,PostgreSQL SQLAlchemy index NULLS NOT DISTINCT,1,1,True
python,79825702,fizer,Moving a figure around the screen using control keys,1,-2,False
python,79825662,Ethan MK,Pandas converts Excel strings like ‘2004E205’ to scientific notation — how to prevent this,1,1,True
python,79825647,v0id0100,How can I put the label in the frame on the left side on Tkinter?,1,0,False
python,79825629,bunsellerboy,Need advice on an operating system mini-project,2,0,True
python,79825599,BBB,Trying to install a package with homebrew results in no package manager error,0,0,False
python,79825580,AmirHosein Sadeghimanesh,I have two simple Python functions with time.sleep and reading data so I/O-bound but I don&#39;t get expected behavior from threading and asyncio,1,0,True
python,79825539,CIRCLE,PaddleOCR is leaking extracted data from a previous document,1,3,True
python,79825506,user31902834,Updating PyInstaller apps,1,0,True
python,79825394,Rainb,How to export or import TOON in pandas?,2,0,False
python,79825363,Didier mac cormick,How to stop/kill achieved Scrapy spider instance within RStudio,0,2,False
python,79825313,pipefish,Incorrect type hint for name parameter in binary_var_list,1,-1,False
python,79825286,Timo,Communicating with two devices over BLE UART in python using bleak,0,3,False
python,79825232,ssp,Best method to manage metrics of prompts that are stored in a git repository,2,0,True
python,79825223,ssp,Prompt managing storing in git v.s. db,0,0,False
python,79825194,Sanjay Jithesh,How to fix ValueError: Only instances of keras.Layer can be added to a Sequential model when adding tensorflow_hub.KerasLayer?,1,3,True
python,79825120,usan,Sphinx sphinx-apidoc generated module titles are too long (full package path). How can I shorten them?,0,0,False
python,79825107,FirePunch,"Can&#39;t find HBO Max sign-in, &quot;unable to locate element&quot; error",1,1,True
python,79825053,WorkerZ,Can&#39;t use lock around gather in Python asyncio,1,2,True
python,79825047,ATP,How to annotate with the generic type of self?,0,2,False
python,79825012,SootDan,Using osmnx with OpenHistoricalMap?,0,2,False
python,79825004,Christopher Pratt,Cannot get command line code to run via python,2,3,True
python,79824981,pileofrogs,Share data between functions called by external library,1,0,True
python,79824972,user29643111,Converting PDF-&gt;json,0,-6,False
python,79824963,sebastian,Clustering without all pairwise distances,0,0,False
python,79824954,Peter Barnes,How do I fix a &quot;TypeError: bad number of pixels&quot; in a healpy.fitsfunc.write_map call?,1,2,True
python,79824937,Kapil,Unable to get the correct year for a UTC timestamp,0,-2,False
python,79824929,Maryam sadat Mousavi,Django Strategies for processing large datasets from an external API without a local replica table,0,-3,False
python,79824925,Eypros,Appropriate method to pass arguments in Flask without using the url,1,0,False
